Pos,Car #,Class,Drivers,Team,Car,Time,Laps,Gap
1,98,Pro Cup,"Nicky Catsburg, Augusto Farfus, Nick Yelloly",Rowe Racing,BMW M4 GT3,2:19.125,141,
2,71,Pro Cup,"Antonio Fuoco, Daniel Serra, Davide Rigon",Iron Lynx,Ferrari 488 GT3,2:19.374,141,2.902
3,88,Pro Cup,"Raffaele Marciello, Daniel Juncadella, Jules Gounon",AMG Team AKKODIS ASP,Mercedes-AMG GT3,2:18.629,141,7.156
4,221,Pro Cup,"Richard Lietz, Michael Christensen, Kevin Estre",GPX Martini Racing,Porsche 911 GT3-R (991.II),2:18.789,141,14.946
5,51,Pro Cup,"Miguel Molina, James Calado, Nicklas Nielsen",Iron Lynx,Ferrari 488 GT3,2:19.510,141,40.718
6,54,Pro Cup,"Klaus Bachler, Come Ledogar, Thomas Preining",Dinamic Motorsport,Porsche 911 GT3-R (991.II),2:18.974,141,41.387
7,2,Pro Cup,"Luca Stolz, Steijn Schothorst, Maxi Götz",AMG Team GetSpeed,Mercedes-AMG GT3,2:18.749,141,42.172
8,47,Pro Cup,"Dennis Olsen, Nick Tandy, Laurens Vanthoor",KCMG,Porsche 911 GT3-R (991.II),2:19.683,141,42.574
9,38,Pro Cup,"Marvin Kirchhöfer, Oliver Wilkinson, Rob Bell",Jota,McLaren 720S GT3,2:19.058,141,43.396
10,55,Pro Cup,"Maro Engel, Maxi Buhk, Mikael Grenier",AMG Team GruppeM Racing,Mercedes-AMG GT3,2:18.928,141,44.078
11,50,Pro Cup,"Daniel Harper, Neil Verhagen, Max Hesse",Rowe Racing,BMW M4 GT3,2:19.625,141,47.585
12,46,Pro Cup,"Valentino Rossi, Frederic Vervisch, Nico Müller",Audi Sport Team WRT,Audi R8 LMS evo II GT3,2:19.944,141,50.063
13,74,Pro Cup,"Felipe Nasr, Matt Campbell, Mathieu Jaminet",EMA Motorsport,Porsche 911 GT3-R (991.II),2:19.286,141,50.433
14,32,Pro Cup,"Dries Vanthoor, Kelvin van der Linde, Charles Weerts",Audi Sport Team WRT,Audi R8 LMS evo II GT3,2:19.763,141,1:20.884
15,30,Silver Cup,"Jean-Baptiste Simmenauer, Benjamin Goethe, Thomas Neubauer",Team WRT,Audi R8 LMS evo II GT3,2:19.860,141,1:26.456
16,25,Pro Cup,"Christopher Mies, Lucas Legeret, Patric Niederhauser",Audi Sport Team Sainteloc Racing,Audi R8 LMS evo II GT3,2:19.166,141,1:31.023
17,14,Silver Cup,"Tuomas Tujula, Stuart White, Konsta Lappalainen",Emil Frey Racing,Lamborghini Huracan GT3 Evo,2:20.104,141,1:35.436
18,95,Pro Cup,"Maxime Martin, Marco Sorensen, Nicki Thiim",Beechdean AMR,Aston Martin Vantage AMR GT3,2:19.878,141,1:49.339
19,5,Gold Cup,"Gabriele Piana, Florian Scholze, Hubert Haupt, Arjun Maini",Haupt Racing Team,Mercedes-AMG GT3,2:19.479,141,1:50.016
20,4,Silver Cup,"Jannes Fittje, Jordan Love, Alain Valente, Frank Bird",Haupt Racing Team,Mercedes-AMG GT3,2:20.235,141,1:56.173
21,11,Silver Cup,"Daniele Di Amato, Lorenzo Patrese, Alberto di Folco, Pierre Alexandre Jean",Tresor by Car Collection,Audi R8 LMS evo II GT3,2:19.837,141,2:00.277
22,19,Pro Cup,"Leo Roussel, Arthur Rougier, Giacomo Altoe",Emil Frey Racing,Lamborghini Huracan GT3 Evo,2:19.402,141,2:01.966
23,100,Pro Cup,"Julien Andlauer, Marvin Dienst, Sven Müller",Toksport WRT,Porsche 911 GT3-R (991.II),2:19.096,141,2:04.370
24,911,Gold Cup,"Ralf Bohn, Alfred Renauer, Robert Renauer",Herberth Motorsport,Porsche 911 GT3-R (991.II),2:19.630,141,2:04.453
25,34,Gold Cup,"Michael Dinan, Robby Foley, Richard Heistand, Jens Klingmann",Walkenhorst Motorsport,BMW M4 GT3,2:20.018,141,2:18.023
26,90,Silver Cup,"Sean Walkinshaw, Oscar Tunjo, Patrick Kujala, Ezequiel Perez Companc",Madpanda Motorsport,Mercedes-AMG GT3,2:20.087,141,3:53.590
27,24,Pro-AM Cup,"Stefan Aust, Niki Leutwiler, Nico Menzel, Alessio Picariello",Herberth Motorsport,Porsche 911 GT3-R (991.II),2:19.337,140,5.377
28,83,Gold Cup,"Doriane Pin, Rahel Frey, Sarah Bovy, Michelle Gatting",Iron Dames,Ferrari 488 GT3,2:21.180,140,16.183
29,188,Pro-AM Cup,"Alexander West, Miguel Ramos, Dean Macdonald, Henrique Chaves",Garage 59,McLaren 720S GT3,2:20.278,140,27.237
30,99,Silver Cup,"Marius Zug, Juuso Puhakka, Nicolas Schöll, Alex Aka",Attempto Racing,Audi R8 LMS evo II GT3,2:19.930,140,1:03.593
31,6,Pro Cup,"Jordan Pepper, Andrea Caldarelli, Marco Mapelli",Orange1 KPAX Racing,Lamborghini Huracan GT3 Evo,2:19.021,140,1:26.840
32,93,Gold Cup,"Jonathan Hui, Loris Spinelli, Chris Froggatt, Eddie Cheever",SKY - Tempesta Racing,Mercedes-AMG GT3,2:18.979,140,1:36.076
33,56,Silver Cup,"Marius Nakken, Mauro Calamia, Giorgio Roda, Mikkel O. Pedersen",Dinamic Motorsport,Porsche 911 GT3-R (991.II),2:19.747,140,1:40.332
34,563,Silver Cup,"Karol Basz, Michele Beretta, Benjamin Hites, Yuki Nemoto",VSR,Lamborghini Huracan GT3 Evo,2:19.998,140,3:36.858
35,52,Pro-AM Cup,"Stefano Costantini, Louis Machiels, Andrea Bertolini, Alessio Rovera",AF Corse,Ferrari 488 GT3,2:19.395,139,20.128
36,66,Pro Cup,"Ricardo Feller, Markus Winkelhock, Dennis Marschall",Audi Sport Team Attempto,Audi R8 LMS evo II GT3,2:19.272,139,20.559
37,163,Silver Cup,"Baptiste Moulin, Mattia Michelotto, Marcus Paverud, Michael Dörrbecker",VSR,Lamborghini Huracan GT3 Evo,2:20.352,139,1:04.769
38,7,Gold Cup,"Brendan Iribe, Sebastian Priaulx, Oliver Millroy, Frederik Schandorff",Inception Racing,McLaren 720S GT3,2:20.875,139,1:05.586
39,77,Gold Cup,"Ahmad Al Harthy, Sam de Haan, Alex MacDowall, Sandy Mitchell",Barwell Motorsport,Lamborghini Huracan GT3 Evo,2:19.087,139,1:35.693
40,63,Pro Cup,"Albert Costa, Mirko Bortolotti, Jack Aitken",Emil Frey Racing,Lamborghini Huracan GT3 Evo,2:18.912,139,1:50.921
41,22,Silver Cup,"Dominik Fischli, Patrik Matthiesen, Vincent Andronaco, Joel Sturm",Allied Racing,Porsche 911 GT3-R (991.II),2:20.042,139,1:55.077
42,57,Gold Cup,"Jens Liebhauser, Russell Ward, Lorenzo Ferrari, Lucas Auer",Winward Racing,Mercedes-AMG GT3,2:19.270,139,2:08.355
43,159,Silver Cup,"James Baldwin, Vargas Manuel Maldonado, Ethan Simioni, Nicolai Kjaergaard",Garage 59,McLaren 720S GT3,2:19.795,138,4.349
44,8,Gold Cup,"Nicolas Gomar, Ruben del Sarte, Loris Cabirou, Mike Parisy",AGS Events,Lamborghini Huracan GT3 Evo,2:21.752,138,1:02.577
45,39,Pro-AM Cup,"Piti Bhirombhakdi, Christophe Hamon, Tanard Sathienthirakul, Earl Bamber",Singha Racing Team TP 12,Porsche 911 GT3-R (991.II),2:20.296,138,1:38.171
46,75,Pro-AM Cup,"Dominik Baumann, Martin Konrad, Kenny Habul, Philip Ellis",SunEnergy1- by SPS,Mercedes-AMG GT3,2:20.321,137,21.305
47,27,Silver Cup,"Max Weering, Isaac Tutumlu Lopez, Taylor Cooke, Brandon Leitch",Leipert Motorsport,Lamborghini Huracan GT3 Evo,2:20.471,137,1:54.545
48,44,Gold Cup,"Patrick Assenheimer, Michael Blanchemain, Axel Blom, Jim Pla",GetSpeed,Mercedes-AMG GT3,2:20.348,137,2:20.253
49,33,Gold Cup,"Arnold Robin, Ryuichiro Tomita, Ulysse De Pauw, Maxime Robin",Team WRT,Audi R8 LMS evo II GT3,2:19.941,136,1:53.053
50,16,Pro-AM Cup,"Adrian Henry de Silva, Stephen Grove, Brenton Grove, Matthew Payne",Earl Bamber Motorsport,Porsche 911 GT3-R (991.II),2:21.033,135,14.017
51,35,Bronze Cup,"Henry Walkenhorst, Jörg Breuer, Donald Yount, Theo Oeverhaus",Walkenhorst Motorsport,BMW M4 GT3,2:21.179,135,1:42.198
52,21,Gold Cup,"Hugo Delacour, Cedric Sbirrazzuoli, Alessandro Balzan, David Perel",AF Corse,Ferrari 488 GT3,2:20.289,133,53.368
53,20,Bronze Cup,"Tim Müller, George Kurtz, Valentin Pierburg, Reema Juffali",SPS automotive performance,Mercedes-AMG GT3,2:23.069,133,1:23.528
54,87,Silver Cup,"Casper Stevenson, Tommaso Mosca, Thomas Drouet",AKKODIS ASP Team,Mercedes-AMG GT3,2:19.659,131,1:27.800
55,3,Silver Cup,"Jeffrey Kingsley, Valdemar Eriksen, Sebastien Baud",GetSpeed,Mercedes-AMG GT3,2:20.024,127,3.274
56,10,Gold Cup,"Karim Ojjeh, Benjamin Lessennes, Antoine Leclerc, Adam Eteki",Boutsen Racing,Audi R8 LMS evo II GT3,2:19.907,127,1:01.569
57,28,Silver Cup,"Samantha Tan, Maxime Oosten, Nick Wittmer, Harry Gottsacker",Samantha Tan Racing,BMW M4 GT3,2:21.059,123,26.746
58,107,Gold Cup,"Nigel Bailly, Stephane Lemeret, Antonin Borga, Maxime Soulet",CMR,Bentley Continental GT3,2:20.067,121,5.078
59,31,Silver Cup,"Diego Menchaca, Lewis Proctor, Finlay Hutchison",Team WRT,Audi R8 LMS evo II GT3,2:20.756,117,1:35.065
60,23,Pro Cup,"Ross Gunn, Alex Riberas, Charlie Eastwood",Heart of Racing with TF Sport,Aston Martin Vantage AMR GT3,2:19.803,108,46.091
61,9,Pro-AM Cup,"Antares Au, Kevin Tse, Dylan Pereira, Jaxon Evans",Herberth Motorsport,Porsche 911 GT3-R (991.II),2:19.742,95,-1:08:48.402
62,12,Pro Cup,"Luca Ghiotto, Christopher Haase, Mattia Drudi",Audi Sport Team Tresor,Audi R8 LMS evo II GT3,2:18.724,92,-1:47:25.997
63,777,Silver Cup,"Al Faisal Al Zubair, Axcil Jefferies, Daniel Morad, Fabian Schiller",Al Manar Racing by HRT,Mercedes-AMG GT3,2:19.448,58,-3:30:07.352
64,97,Silver Cup,"David Pittard, Charlie Fagg, Theo Nouet, Roman de Angelis",Beechdean AMR,Aston Martin Vantage AMR GT3,2:20.980,57,-3:33:22.186
65,91,Gold Cup,"Alex Malykhin, Julien Apotheloz, Florian Latorre, Ayhancan Güven",Allied Racing,Porsche 911 GT3-R (991.II),2:21.279,57,-3:30:27.227
66,26,Silver Cup,"Aurelien Panis, Cesar Gazeau, Gilles Magnus, Nicolas Baert",Sainteloc Junior Team,Audi R8 LMS evo II GT3,2:19.667,38,-4:29:30.834
