Pos,Car #,Class,Drivers,Team,Car,Time,Laps,Gap
1,51,Pro Cup,"Come Ledogar, Nicklas Nielsen, Alessandro Pier Guidi",Iron Lynx,Ferrari 488 GT3,2:19.228,275,
2,32,Pro Cup,"Dries Vanthoor, Kelvin van der Linde, Charles Weerts",Audi Sport Team WRT,Audi R8 LMS GT3,2:19.988,275,16.599
3,95,Pro Cup,"Nicki Thiim, Ross Gunn, Marco Sorensen",Garage 59,Aston Martin Vantage AMR GT3,2:19.265,275,18.819
4,88,Pro Cup,"Raffaele Marciello, Daniel Juncadella, Jules Gounon",Mercedes-AMG Team Akka ASP,Mercedes-AMG GT3,2:19.753,275,48.592
5,66,Pro Cup,"Mattia Drudi, Dennis Marschall, Christopher Mies",Audi Sport Team Attempto Racing,Audi R8 LMS GT3,2:20.504,274,31.131
6,54,Pro Cup,"Klaus Bachler, Christian Engelhart, Matteo Cairoli",Dinamic Motorsport,Porsche 911 GT3-R (991.II),2:20.824,274,34.553
7,37,Pro Cup,"Nico Müller, Robin Frijns, Dennis Lind",Audi Sport Team WRT,Audi R8 LMS GT3,2:20.160,274,1:01.705
8,47,Pro Cup,"Maxime Martin, Nick Tandy, Laurens Vanthoor",KCMG,Porsche 911 GT3-R (991.II),2:19.928,274,1:26.637
9,38,Pro Cup,"Rob Bell, Oliver Wilkinson, Ben Barnicoat",Jota,McLaren 720S GT3,2:19.279,274,1:49.300
10,63,Pro Cup,"Mirko Bortolotti, Marco Mapelli, Andrea Caldarelli",Orange 1 FFF Racing Team,Lamborghini Huracan GT3 Evo,2:19.679,274,1:56.380
11,25,Pro Cup,"Markus Winkelhock, Patric Niederhauser, Christopher Haase",Audi Sport Team Sainteloc Racing,Audi R8 LMS GT3,2:20.327,274,2:36.499
12,18,Pro Cup,"Edoardo Liberati, Alexandre Imperatori, Joshua Burdon",KCMG,Porsche 911 GT3-R (991.II),2:21.041,273,1:07.602
13,90,Silver Cup,"Ezequiel Perez Companc, Ricardo Sanchez, Patrick Kujala, Rik Breukers",Madpanda Motorsport,Mercedes-AMG GT3,2:20.563,273,1:19.901
14,89,Pro Cup,"Lucas Auer, Timur Boguslavskiy, Felipe Fraga",AKKA ASP,Mercedes-AMG GT3,2:20.878,273,1:32.506
15,4,Pro Cup,"Maro Engel, Luca Stolz, Vincent Abril",Mercedes-AMG Team HRT,Mercedes-AMG GT3,2:20.615,273,1:50.022
16,31,Silver Cup,"Ryuichiro Tomita, Frank Bird, Valdemar Eriksen",Team WRT,Audi R8 LMS GT3,2:21.075,273,3:55.259
17,33,Silver Cup,"Benja Hites, Fabrizio Crestani, David Perel",Team Rinaldi Racing,Ferrari 488 GT3,2:21.305,272,-6.477
18,93,Pro-AM Cup,"Jonathan Hui, Chris Froggatt, Matteo Cressoni, Edward Cheever",SKY - Tempesta Racing,Ferrari 488 GT3,2:20.659,272,55.278
19,53,Pro-AM Cup,"Duncan Cameron, Rino Mastronardi, Matt Griffin, Miguel Molina",AF Corse,Ferrari 488 GT3,2:20.726,272,1:03.200
20,52,Pro-AM Cup,"Louis Machiels, John Wartique, Andrea Bertolini, Alessio Rovera",AF Corse,Ferrari 488 GT3,2:20.218,272,1:12.839
21,7,Silver Cup,"Axcil Ramar Jefferies, Oscar Tunjo, Paul Petit, Marvin Dienst",Toksport WRT,Mercedes-AMG GT3,2:20.900,272,1:25.024
22,159,Silver Cup,"Tuomas Tujula, Alex MacDowall, Valentin Hasse Clot, Nicolai Kjaergaard",Garage 59,Aston Martin Vantage AMR GT3,2:21.151,272,1:28.518
23,99,Silver Cup,"Fabien Lavergne, Max Hofer, Alex Aka",Attempto Racing,Audi R8 LMS GT3,2:19.753,272,1:35.459
24,77,Pro-AM Cup,"Miguel Ramos, Leo Machitski, Henrique Chaves, Sandy Mitchell",Barwell Motorsport,Lamborghini Huracan GT3 Evo,2:20.595,272,2:10.384
25,30,Silver Cup,"James Pull, Franco Colapinto, Benjamin Goethe",Team WRT,Audi R8 LMS GT3,2:21.588,271,43.583
26,20,Pro-AM Cup,"Valentin Pierburg, George Kurtz, Colin Braun, Dominik Baumann",SPS automotive performance,Mercedes-AMG GT3,2:20.736,271,50.813
27,40,Silver Cup,"Miklas Born, Jordan Love, Yannick Mettler, Lance David Arnold",SPS automotive performance,Mercedes-AMG GT3,2:21.069,271,1:44.876
28,2,Pro-AM Cup,"Nico Bastian, Florian Scholze, Olivier Grotz, Jim Pla",GetSpeed,Mercedes-AMG GT3,2:20.585,271,1:46.366
29,107,Silver Cup,"Stuart White, Pierre-Alexandre Jean, Nelson Panciatici, Ulysse De Pauw",CMR,Bentley Continental GT3,2:20.220,271,2:04.140
30,27,Silver Cup,"Alexandre Cougnaud, Lucas Legeret, Louis Prette, Aurelien Panis",Sainteloc Racing,Audi R8 LMS GT3,2:20.971,271,3:24.598
31,61,Pro-AM Cup,"Wolfgang Triller, Carlos Rivas, Reid Harker, Will Bamber",EBM Giga Racing,Porsche 911 GT3-R (991.II),2:20.943,270,14.452
32,69,Pro-AM Cup,"Sam de Haan, Rob Collard, Ricky Collard Jr., Fabian Schiller",Ram Racing,Mercedes-AMG GT3,2:20.739,270,1:28.219
33,10,Pro-AM Cup,"Jens Liebhauser, Karim Ojjeh, Yann Zimmer, Jens Klingmann",Boutsen Ginion,BMW M6 GT3,2:20.973,270,1:33.860
34,87,Silver Cup,"Simon Gachet, Konstantin Tereschenko, Petru Razvan Umbrarescu, Thomas Drouet",AKKA ASP,Mercedes-AMG GT3,2:21.526,270,1:54.751
35,16,Silver Cup,"Alberto di Folco, Tim Zimmermann, Kikko Galbiati, Clemens Schmid",GRT Grasser Racing Team,Lamborghini Huracan GT3 Evo,2:21.686,270,2:02.546
36,911,Pro-AM Cup,"Antares Au, Daniel Allemann, Alfred Renauer, Robert Renauer",Herberth Motorsport,Porsche 911 GT3-R (991.II),2:21.361,269,25.067
37,166,AM Cup,"Pieder Decurtins, Dennis Busch, Manuel Lauck, Marc Basseng",Haegeli by T2 Racing,Porsche 911 GT3-R (991.II),2:22.588,268,2:12.523
38,14,Silver Cup,"Alex Fontana, Rolf Ineichen, Ricardo Feller",Emil Frey Racing,Lamborghini Huracan GT3 Evo,2:20.060,267,18.302
39,23,AM Cup,"Jacob Schell, Ivan Jacoma, Niki Leutwiler, Nico Menzel",Huber Motorsport,Porsche 911 GT3-R (991.II),2:21.054,267,24.634
40,11,Pro-AM Cup,"Tim Kohmann, Francesco Zollo, Giorgio Roda, David Fumanelli",Kessel Racing,Ferrari 488 GT3,2:20.405,266,17.260
41,222,Silver Cup,"Lars Kern, Bastian Buus, Julien Apotheloz, Arno Santamato",Team Allied Racing,Porsche 911 GT3-R (991.II),2:21.194,265,51.188
42,70,Pro-AM Cup,"Oliver Millroy, Brendan Iribe, Kevin Madsen, Jordan Pepper",Inception Racing,McLaren 720S GT3,2:19.359,262,13.801
43,3,Pro Cup,"Dennis Olsen, Michael Christensen, Frederic Makowiecki",Schnabl Engineering,Porsche 911 GT3-R (991.II),2:20.815,254,-44:37.319
44,666,Silver Cup,"Martin Rump, Glenn van Berlo, Baptiste Moulin, Yuki Nemoto",VS Racing,Lamborghini Huracan GT3 Evo,2:21.549,245,-1:07:45.357
45,50,Pro Cup,"Nicky Catsburg, Maxi Buhk, Maxi Götz",Hub Auto,Mercedes-AMG GT3,2:21.417,245,-50:33.133
46,22,Pro Cup,"Matt Campbell, Earl Bamber, Mathieu Jaminet",GPX Martini Racing,Porsche 911 GT3-R (991.II),2:19.746,244,-1:11:11.201
47,188,Pro-AM Cup,"Alexander West, Chris Goodwin, Charlie Eastwood, Marvin Kirchhöfer",Garage 59,Aston Martin Vantage AMR GT3,2:19.889,244,57.570
48,34,Pro Cup,"Sheldon van der Linde, David Pittard, Marco Wittmann",Walkenhorst Motorsport,BMW M6 GT3,2:20.200,221,-2:21:14.873
49,35,Pro Cup,"Timo Glock, Martin Tomczyk, Thomas Neubauer",Walkenhorst Motorsport,BMW M6 GT3,2:20.103,213,-2:22:57.919
50,19,Pro-AM Cup,"Bertrand Baguette, Hiroshi Hamaguchi, Stefano Costantini, Phil Keen",Orange 1 FFF Racing Team,Lamborghini Huracan GT3 Evo,2:21.116,180,-2:57:52.993
51,57,Silver Cup,"Russel Ward, Mikael Grenier, Philip Ellis",Winward Racing,Mercedes-AMG GT3,2:20.893,167,-4:29:41.548
52,26,Pro Cup,"Jamie Green, Finlay Hutchison, Adrien Tambay",Sainteloc Racing,Audi R8 LMS GT3,2:22.128,155,-4:48:02.613
53,56,Pro Cup,"Romain Dumas, Andrea Rizzoli, Mikkel O. Pedersen",Dinamic Motorsport,Porsche 911 GT3-R (991.II),2:22.211,134,-5:52:14.580
54,5,Silver Cup,"Michele Beretta, Hubert Haupt, Patrick Assenheimer, Indy Dontje",HRT,Mercedes-AMG GT3,2:21.204,71,-8:31:57.175
55,114,Pro Cup,"Konsta Lappalainen, Jack Aitken, Arthur Rougier",Emil Frey Racing,Lamborghini Huracan GT3 Evo,2:21.419,9,-11:41:13.793
56,163,Pro Cup,"Giacomo Altoe, Franck Perera, Albert Costa",Emil Frey Racing,Lamborghini Huracan GT3 Evo,2:21.463,9,-11:41:11.483
57,71,Pro Cup,"Antonio Fuoco, Callum Ilott, Davide Rigon",Iron Lynx,Ferrari 488 GT3,2:21.477,9,-11:41:10.293
58,21,Pro Cup,"Sven Müller, Richard Lietz, Kevin Estre",Rutronik Racing,Porsche 911 GT3-R (991.II),2:21.598,9,-11:41:09.679
