Pos,Car #,Class,Drivers,Team,Car,Time,Laps,Gap
1,51,Pro Cup,"Miguel Molina, James Calado, Nicklas Nielsen",Iron Lynx,Ferrari 488 GT3,2:18.292,,
2,221,Pro Cup,"Richard Lietz, Michael Christensen, Kevin Estre",GPX Martini Racing,Porsche 911 GT3-R (991.II),2:18.324,,0.032
3,2,Pro Cup,"Luca Stolz, Steijn Schothorst, Maxi Götz",AMG Team GetSpeed,Mercedes-AMG GT3,2:18.406,,0.114
4,7,Gold Cup,"Brendan Iribe, Sebastian Priaulx, Oliver Millroy, Frederik Schandorff",Inception Racing,McLaren 720S GT3,2:18.427,,0.135
5,47,Pro Cup,"Dennis Olsen, Nick Tandy, Laurens Vanthoor",KCMG,Porsche 911 GT3-R (991.II),2:18.452,,0.160
6,9,Pro-AM Cup,"Antares Au, Kevin Tse, Dylan Pereira, Jaxon Evans",Herberth Motorsport,Porsche 911 GT3-R (991.II),2:18.483,,0.191
7,87,Silver Cup,"Casper Stevenson, Tommaso Mosca, Thomas Drouet",AKKODIS ASP Team,Mercedes-AMG GT3,2:18.553,,0.261
8,88,Pro Cup,"Raffaele Marciello, Daniel Juncadella, Jules Gounon",AMG Team AKKODIS ASP,Mercedes-AMG GT3,2:18.587,,0.295
9,6,Pro Cup,"Jordan Pepper, Andrea Caldarelli, Marco Mapelli",Orange1 KPAX Racing,Lamborghini Huracan GT3 Evo,2:18.606,,0.314
10,57,Gold Cup,"Jens Liebhauser, Russell Ward, Lorenzo Ferrari, Lucas Auer",Winward Racing,Mercedes-AMG GT3,2:18.702,,0.410
11,188,Pro-AM Cup,"Alexander West, Miguel Ramos, Dean Macdonald, Henrique Chaves",Garage 59,McLaren 720S GT3,2:18.721,,0.429
12,911,Gold Cup,"Ralf Bohn, Alfred Renauer, Robert Renauer",Herberth Motorsport,Porsche 911 GT3-R (991.II),2:18.761,,0.469
13,55,Pro Cup,"Maro Engel, Maxi Buhk, Mikael Grenier",AMG Team GruppeM Racing,Mercedes-AMG GT3,2:18.785,,0.493
14,98,Pro Cup,"Nicky Catsburg, Augusto Farfus, Nick Yelloly",Rowe Racing,BMW M4 GT3,2:18.877,,0.585
15,50,Pro Cup,"Daniel Harper, Neil Verhagen, Max Hesse",Rowe Racing,BMW M4 GT3,2:18.896,,0.604
16,38,Pro Cup,"Marvin Kirchhöfer, Oliver Wilkinson, Rob Bell",Jota,McLaren 720S GT3,2:18.938,,0.646
17,71,Pro Cup,"Antonio Fuoco, Daniel Serra, Davide Rigon",Iron Lynx,Ferrari 488 GT3,2:18.940,,0.648
18,4,Silver Cup,"Jannes Fittje, Jordan Love, Alain Valente, Frank Bird",Haupt Racing Team,Mercedes-AMG GT3,2:18.951,,0.659
19,74,Pro Cup,"Felipe Nasr, Matt Campbell, Mathieu Jaminet",EMA Motorsport,Porsche 911 GT3-R (991.II),2:18.977,,0.685
20,159,Silver Cup,"James Baldwin, Vargas Manuel Maldonado, Ethan Simioni, Nicolai Kjaergaard",Garage 59,McLaren 720S GT3,2:18.985,,0.693
21,63,Pro Cup,"Albert Costa, Mirko Bortolotti, Jack Aitken",Emil Frey Racing,Lamborghini Huracan GT3 Evo,2:18.997,,0.705
22,44,Gold Cup,"Patrick Assenheimer, Michael Blanchemain, Axel Blom, Jim Pla",GetSpeed,Mercedes-AMG GT3,2:19.019,,0.727
23,23,Pro Cup,"Ross Gunn, Alex Riberas, Charlie Eastwood",Heart of Racing with TF Sport,Aston Martin Vantage AMR GT3,2:19.117,,0.825
24,30,Silver Cup,"Jean-Baptiste Simmenauer, Benjamin Goethe, Thomas Neubauer",Team WRT,Audi R8 LMS evo II GT3,2:19.151,,0.859
25,33,Gold Cup,"Arnold Robin, Ryuichiro Tomita, Ulysse De Pauw, Maxime Robin",Team WRT,Audi R8 LMS evo II GT3,2:19.151,,0.859
26,26,Silver Cup,"Aurelien Panis, Cesar Gazeau, Gilles Magnus, Nicolas Baert",Sainteloc Junior Team,Audi R8 LMS evo II GT3,2:19.167,,0.875
27,22,Silver Cup,"Dominik Fischli, Patrik Matthiesen, Vincent Andronaco, Joel Sturm",Allied Racing,Porsche 911 GT3-R (991.II),2:19.303,,1.011
28,54,Pro Cup,"Klaus Bachler, Come Ledogar, Thomas Preining",Dinamic Motorsport,Porsche 911 GT3-R (991.II),2:19.426,,1.134
29,19,Pro Cup,"Leo Roussel, Arthur Rougier, Giacomo Altoe",Emil Frey Racing,Lamborghini Huracan GT3 Evo,2:19.455,,1.163
30,5,Gold Cup,"Gabriele Piana, Florian Scholze, Hubert Haupt, Arjun Maini",Haupt Racing Team,Mercedes-AMG GT3,2:19.481,,1.189
31,91,Gold Cup,"Alex Malykhin, Julien Apotheloz, Florian Latorre, Ayhancan Güven",Allied Racing,Porsche 911 GT3-R (991.II),2:19.507,,1.215
32,11,Silver Cup,"Daniele Di Amato, Lorenzo Patrese, Alberto di Folco, Pierre Alexandre Jean",Tresor by Car Collection,Audi R8 LMS evo II GT3,2:19.518,,1.226
33,52,Pro-AM Cup,"Stefano Costantini, Louis Machiels, Andrea Bertolini, Alessio Rovera",AF Corse,Ferrari 488 GT3,2:19.518,,1.226
34,12,Pro Cup,"Luca Ghiotto, Christopher Haase, Mattia Drudi",Audi Sport Team Tresor,Audi R8 LMS evo II GT3,2:19.558,,1.266
35,14,Silver Cup,"Tuomas Tujula, Stuart White, Konsta Lappalainen",Emil Frey Racing,Lamborghini Huracan GT3 Evo,2:19.581,,1.289
36,93,Gold Cup,"Jonathan Hui, Loris Spinelli, Chris Froggatt, Eddie Cheever",SKY - Tempesta Racing,Mercedes-AMG GT3,2:19.670,,1.378
37,32,Pro Cup,"Dries Vanthoor, Kelvin van der Linde, Charles Weerts",Audi Sport Team WRT,Audi R8 LMS evo II GT3,2:19.674,,1.382
38,75,Pro-AM Cup,"Dominik Baumann, Martin Konrad, Kenny Habul, Philip Ellis",SunEnergy1- by SPS,Mercedes-AMG GT3,2:19.696,,1.404
39,27,Silver Cup,"Max Weering, Isaac Tutumlu Lopez, Taylor Cooke, Brandon Leitch",Leipert Motorsport,Lamborghini Huracan GT3 Evo,2:19.773,,1.481
40,66,Pro Cup,"Ricardo Feller, Markus Winkelhock, Dennis Marschall",Audi Sport Team Attempto,Audi R8 LMS evo II GT3,2:19.808,,1.516
41,163,Silver Cup,"Baptiste Moulin, Mattia Michelotto, Marcus Paverud, Michael Dörrbecker",VSR,Lamborghini Huracan GT3 Evo,2:19.811,,1.519
42,25,Pro Cup,"Lucas Legeret, Christopher Mies, Patric Niederhauser",Audi Sport Team Sainteloc Racing,Audi R8 LMS evo II GT3,2:19.816,,1.524
43,100,Pro Cup,"Julien Andlauer, Marvin Dienst, Sven Müller",Toksport WRT,Porsche 911 GT3-R (991.II),2:19.830,,1.538
44,21,Gold Cup,"Hugo Delacour, Cedric Sbirrazzuoli, Alessandro Balzan, David Perel",AF Corse,Ferrari 488 GT3,2:19.936,,1.644
45,56,Silver Cup,"Marius Nakken, Mauro Calamia, Giorgio Roda, Mikkel O. Pedersen",Dinamic Motorsport,Porsche 911 GT3-R (991.II),2:20.033,,1.741
46,24,Pro-AM Cup,"Stefan Aust, Niki Leutwiler, Nico Menzel, Alessio Picariello",Herberth Motorsport,Porsche 911 GT3-R (991.II),2:20.081,,1.789
47,99,Silver Cup,"Marius Zug, Juuso Puhakka, Nicolas Schöll, Alex Aka",Attempto Racing,Audi R8 LMS evo II GT3,2:20.108,,1.816
48,777,Silver Cup,"Al Faisal Al Zubair, Axcil Jefferies, Daniel Morad, Fabian Schiller",Al Manar Racing by HRT,Mercedes-AMG GT3,2:20.131,,1.839
49,563,Silver Cup,"Karol Basz, Michele Beretta, Benjamin Hites, Yuki Nemoto",VSR,Lamborghini Huracan GT3 Evo,2:20.176,,1.884
50,35,Bronze Cup,"Henry Walkenhorst, Jörg Breuer, Donald Yount, Theo Oeverhaus",Walkenhorst Motorsport,BMW M4 GT3,2:20.179,,1.887
51,90,Silver Cup,"Sean Walkinshaw, Oscar Tunjo, Patrick Kujala, Ezequiel Perez Companc",Madpanda Motorsport,Mercedes-AMG GT3,2:20.289,,1.997
52,3,Silver Cup,"Jeffrey Kingsley, Valdemar Eriksen, Sebastien Baud",GetSpeed,Mercedes-AMG GT3,2:20.385,,2.093
53,83,Gold Cup,"Doriane Pin, Rahel Frey, Sarah Bovy, Michelle Gatting",Iron Dames,Ferrari 488 GT3,2:20.395,,2.103
54,10,Gold Cup,"Karim Ojjeh, Benjamin Lessennes, Antoine Leclerc, Adam Eteki",Boutsen Racing,Audi R8 LMS evo II GT3,2:20.416,,2.124
55,97,Silver Cup,"David Pittard, Charlie Fagg, Theo Nouet, Roman de Angelis",Beechdean AMR,Aston Martin Vantage AMR GT3,2:20.529,,2.237
56,77,Gold Cup,"Ahmad Al Harthy, Sam de Haan, Alex MacDowall, Sandy Mitchell",Barwell Motorsport,Lamborghini Huracan GT3 Evo,2:20.556,,2.264
57,31,Silver Cup,"Diego Menchaca, Lewis Proctor, Finlay Hutchison",Team WRT,Audi R8 LMS evo II GT3,2:20.700,,2.408
58,107,Gold Cup,"Nigel Bailly, Stephane Lemeret, Antonin Borga, Maxime Soulet",CMR,Bentley Continental GT3,2:20.723,,2.431
59,46,Pro Cup,"Valentino Rossi, Frederic Vervisch, Nico Müller",Audi Sport Team WRT,Audi R8 LMS evo II GT3,2:20.807,,2.515
60,95,Pro Cup,"Maxime Martin, Marco Sorensen, Nicki Thiim",Beechdean AMR,Aston Martin Vantage AMR GT3,2:20.834,,2.542
61,34,Gold Cup,"Michael Dinan, Robby Foley, Richard Heistand, Jens Klingmann",Walkenhorst Motorsport,BMW M4 GT3,2:20.937,,2.645
62,20,Bronze Cup,"Tim Müller, George Kurtz, Valentin Pierburg, Reema Juffali",SPS automotive performance,Mercedes-AMG GT3,2:22.915,,4.623
63,8,Gold Cup,"Nicolas Gomar, Ruben del Sarte, Loris Cabirou, Mike Parisy",AGS Events,Lamborghini Huracan GT3 Evo,2:23.431,,5.139
64,39,Pro-AM Cup,"Piti Bhirombhakdi, Christophe Hamon, Tanard Sathienthirakul, Earl Bamber",Singha Racing Team TP 12,Porsche 911 GT3-R (991.II),2:25.207,,6.915
65,16,Pro-AM Cup,"Adrian Henry de Silva, Stephen Grove, Brenton Grove, Matthew Payne",Earl Bamber Motorsport,Porsche 911 GT3-R (991.II),2:26.801,,8.509
66,28,Silver Cup,"Samantha Tan, Maxime Oosten, Nick Wittmer, Harry Gottsacker",Samantha Tan Racing,BMW M4 GT3,2:26.835,,8.543
