Pos,Car #,Class,Drivers,Team,Car,Time,Laps,Gap
1,22,Pro Cup,"Matt Campbell, Earl Bamber, Mathieu Jaminet",GPX Martini Racing,Porsche 911 GT3-R (991.II),2:19.569,,
2,37,Pro Cup,"Nico Müller, Robin Frijns, Dennis Lind",Audi Sport Team WRT,Audi R8 LMS GT3,2:19.807,,0.238
3,88,Pro Cup,"Raffaele Marciello, Daniel Juncadella, Jules Gounon",Mercedes-AMG Team Akka ASP,Mercedes-AMG GT3,2:19.956,,0.387
4,71,Pro Cup,"Antonio Fuoco, Callum Ilott, Davide Rigon",Iron Lynx,Ferrari 488 GT3,2:20.030,,0.461
5,114,Pro Cup,"Konsta Lappalainen, Jack Aitken, Arthur Rougier",Emil Frey Racing,Lamborghini Huracan GT3 Evo,2:20.088,,0.519
6,63,Pro Cup,"Mirko Bortolotti, Marco Mapelli, Andrea Caldarelli",Orange 1 FFF Racing Team,Lamborghini Huracan GT3 Evo,2:20.155,,0.586
7,18,Pro Cup,"Edoardo Liberati, Alexandre Imperatori, Joshua Burdon",KCMG,Porsche 911 GT3-R (991.II),2:20.254,,0.685
8,51,Pro Cup,"Come Ledogar, Nicklas Nielsen, Alessandro Pier Guidi",Iron Lynx,Ferrari 488 GT3,2:20.439,,0.870
9,54,Pro Cup,"Klaus Bachler, Christian Engelhart, Matteo Cairoli",Dinamic Motorsport,Porsche 911 GT3-R (991.II),2:20.448,,0.879
10,52,Pro-AM Cup,"Louis Machiels, John Wartique, Andrea Bertolini, Alessio Rovera",AF Corse,Ferrari 488 GT3,2:20.459,,0.890
11,47,Pro Cup,"Maxime Martin, Nick Tandy, Laurens Vanthoor",KCMG,Porsche 911 GT3-R (991.II),2:20.473,,0.904
12,32,Pro Cup,"Dries Vanthoor, Kelvin van der Linde, Charles Weerts",Audi Sport Team WRT,Audi R8 LMS GT3,2:20.481,,0.912
13,4,Pro Cup,"Maro Engel, Luca Stolz, Vincent Abril",Mercedes-AMG Team HRT,Mercedes-AMG GT3,2:20.488,,0.919
14,7,Silver Cup,"Berkay Besler, Oscar Tunjo, Paul Petit, Marvin Dienst",Toksport WRT,Mercedes-AMG GT3,2:20.494,,0.925
15,38,Pro Cup,"Rob Bell, Oliver Wilkinson, Ben Barnicoat",Jota,McLaren 720S GT3,2:20.536,,0.967
16,50,Pro Cup,"Nicky Catsburg, Maxi Buhk, Maxi Götz",Hub Auto,Mercedes-AMG GT3,2:20.569,,1.000
17,89,Pro Cup,"Lucas Auer, Timur Boguslavskiy, Felipe Fraga",AKKA ASP,Mercedes-AMG GT3,2:20.619,,1.050
18,34,Pro Cup,"Sheldon van der Linde, David Pittard, Marco Wittmann",Walkenhorst Motorsport,BMW M6 GT3,2:20.664,,1.095
19,21,Pro Cup,"Sven Müller, Richard Lietz, Kevin Estre",Rutronik Racing,Porsche 911 GT3-R (991.II),2:20.856,,1.287
20,25,Pro Cup,"Markus Winkelhock, Patric Niederhauser, Christopher Haase",Audi Sport Team Sainteloc Racing,Audi R8 LMS GT3,2:20.857,,1.288
21,57,Silver Cup,"Russel Ward, Mikael Grenier, Philip Ellis",Winward Racing,Mercedes-AMG GT3,2:20.911,,1.342
22,33,Silver Cup,"Benja Hites, Fabrizio Crestani, David Perel",Team Rinaldi Racing,Ferrari 488 GT3,2:20.920,,1.351
23,23,AM Cup,"Jacob Schell, Ivan Jacoma, Niki Leutwiler, Nico Menzel",Huber Motorsport,Porsche 911 GT3-R (991.II),2:20.949,,1.380
24,95,Pro Cup,"Nicki Thiim, Ross Gunn, Marco Sorensen",Garage 59,Aston Martin Vantage AMR GT3,2:20.963,,1.394
25,107,Silver Cup,"Stuart White, Pierre-Alexandre Jean, Nelson Panciatici, Ulysse De Pauw",CMR,Bentley Continental GT3,2:21.014,,1.445
26,666,Silver Cup,"Martin Rump, Glenn van Berlo, Baptiste Moulin, Yuki Nemoto",VS Racing,Lamborghini Huracan GT3 Evo,2:21.015,,1.446
27,77,Pro-AM Cup,"Miguel Ramos, Leo Machitski, Henrique Chaves, Sandy Mitchell",Barwell Motorsport,Lamborghini Huracan GT3 Evo,2:21.077,,1.508
28,2,Pro-AM Cup,"Nico Bastian, Florian Scholze, Olivier Grotz, Jim Pla",GetSpeed,Mercedes-AMG GT3,2:21.117,,1.548
29,14,Silver Cup,"Alex Fontana, Rolf Ineichen, Ricardo Feller",Emil Frey Racing,Lamborghini Huracan GT3 Evo,2:21.214,,1.645
30,35,Pro Cup,"Timo Glock, Martin Tomczyk, Thomas Neubauer",Walkenhorst Motorsport,BMW M6 GT3,2:21.247,,1.678
31,188,Pro-AM Cup,"Alexander West, Chris Goodwin, Charlie Eastwood, Marvin Kirchhöfer",Garage 59,Aston Martin Vantage AMR GT3,2:21.295,,1.726
32,163,Pro Cup,"Giacomo Altoe, Franck Perera, Albert Costa",Emil Frey Racing,Lamborghini Huracan GT3 Evo,2:21.309,,1.740
33,99,Silver Cup,"Fabien Lavergne, Max Hofer, Alex Aka",Attempto Racing,Audi R8 LMS GT3,2:21.440,,1.871
34,5,Silver Cup,"Michele Beretta, Hubert Haupt, Patrick Assenheimer, Indy Dontje",HRT,Mercedes-AMG GT3,2:21.447,,1.878
35,87,Silver Cup,"Simon Gachet, Konstantin Tereschenko, Petru Razvan Umbrarescu, Thomas Drouet",AKKA ASP,Mercedes-AMG GT3,2:21.459,,1.890
36,3,Pro Cup,"Dennis Olsen, Michael Christensen, Frederic Makowiecki",Schnabl Engineering,Porsche 911 GT3-R (991.II),2:21.480,,1.911
37,93,Pro-AM Cup,"Jonathan Hui, Chris Froggatt, Matteo Cressoni, Edward Cheever",SKY - Tempesta Racing,Ferrari 488 GT3,2:21.495,,1.926
38,66,Pro Cup,"Mattia Drudi, Dennis Marschall, Christopher Mies",Audi Sport Team Attempto Racing,Audi R8 LMS GT3,2:21.646,,2.077
39,26,Pro Cup,"Jamie Green, Finlay Hutchison, Adrien Tambay",Sainteloc Racing,Audi R8 LMS GT3,2:21.647,,2.078
40,159,Silver Cup,"Tuomas Tujula, Alex MacDowall, Valentin Hasse Clot, Nicolai Kjaergaard",Garage 59,Aston Martin Vantage AMR GT3,2:21.683,,2.114
41,56,Pro Cup,"Romain Dumas, Andrea Rizzoli, Mikkel O. Pedersen",Dinamic Motorsport,Porsche 911 GT3-R (991.II),2:21.686,,2.117
42,90,Silver Cup,"Ezequiel Perez Companc, Ricardo Sanchez, Patrick Kujala, Rik Breukers",Madpanda Motorsport,Mercedes-AMG GT3,2:21.782,,2.213
43,70,Pro-AM Cup,"Oliver Millroy, Brendan Iribe, Kevin Madsen, Jordan Pepper",Inception Racing,McLaren 720S GT3,2:21.832,,2.263
44,222,Silver Cup,"Lars Kern, Bastian Buus, Julien Apotheloz, Arno Santamato",Team Allied Racing,Porsche 911 GT3-R (991.II),2:21.835,,2.266
45,53,Pro-AM Cup,"Duncan Cameron, Rino Mastronardi, Matt Griffin, Miguel Molina",AF Corse,Ferrari 488 GT3,2:21.993,,2.424
46,11,Pro-AM Cup,"Tim Kohmann, Francesco Zollo, Giorgio Roda, David Fumanelli",Kessel Racing,Ferrari 488 GT3,2:22.083,,2.514
47,69,Pro-AM Cup,"Sam de Haan, Rob Collard, Ricky Collard Jr., Fabian Schiller",Ram Racing,Mercedes-AMG GT3,2:22.132,,2.563
48,19,Pro-AM Cup,"Bertrand Baguette, Hiroshi Hamaguchi, Stefano Costantini, Phil Keen",Orange 1 FFF Racing Team,Lamborghini Huracan GT3 Evo,2:22.212,,2.643
49,30,Silver Cup,"James Pull, Franco Colapinto, Benjamin Goethe",Team WRT,Audi R8 LMS GT3,2:22.489,,2.920
50,20,Pro-AM Cup,"Valentin Pierburg, George Kurtz, Colin Braun, Dominik Baumann",SPS automotive performance,Mercedes-AMG GT3,2:22.583,,3.014
51,10,Pro-AM Cup,"Jens Liebhauser, Karim Ojjeh, Yann Zimmer, Jens Klingmann",Boutsen Ginion,BMW M6 GT3,2:22.641,,3.072
52,40,Silver Cup,"Miklas Born, Jordan Love, Yannick Mettler, Lance David Arnold",SPS automotive performance,Mercedes-AMG GT3,2:22.659,,3.090
53,27,Silver Cup,"Alexandre Cougnaud, Lucas Legeret, Louis Prette, Aurelien Panis",Sainteloc Racing,Audi R8 LMS GT3,2:22.814,,3.245
54,911,Pro-AM Cup,"Antares Au, Daniel Allemann, Alfred Renauer, Robert Renauer",Herberth Motorsport,Porsche 911 GT3-R (991.II),2:23.094,,3.525
55,61,Pro-AM Cup,"Adrian Henry de Silva, Carlos Rivas, Reid Harker, Will Bamber",EBM Giga Racing,Porsche 911 GT3-R (991.II),2:23.471,,3.902
56,166,AM Cup,"Pieder Decurtins, Dennis Busch, Manuel Lauck, Marc Basseng",Haegeli by T2 Racing,Porsche 911 GT3-R (991.II),2:23.509,,3.940
DNS,16,Silver Cup,"Alberto di Folco, Tim Zimmermann, Kikko Galbiati, Clemens Schmid",GRT Grasser Racing Team,Lamborghini Huracan GT3 Evo,,,
DNS,31,Silver Cup,"Ryuichiro Tomita, Frank Bird, Valdemar Eriksen",Team WRT,Audi R8 LMS GT3,,,
