Pos,Car #,Class,Drivers,Team,Car,Time,Laps,Gap
1,17,Pro Cup,"Luca Engstler, Kelvin van der Linde, Nicki Thiim",Scherer Sport PHX,Audi R8 LMS GT3 EVO II,2:17.649,342,
2,40,Pro Cup,"Ricardo Feller, Mattia Drudi, Dennis Marschall",Audi Sport Tresor Orange 1,Audi R8 LMS GT3 EVO II,2:18.097,342,1.361
3,98,Pro Cup,"Philipp Eng, Marco Wittmann, Nick Yelloly",Rowe Racing,BMW M4 GT3,2:17.743,342,4.294
4,92,Pro Cup,"Julien Andlauer, Laurens Vanthoor, Kevin Estre",Manthey EMA,Porsche 911 GT3 R (992),2:17.191,342,14.412
5,96,Pro Cup,"Thomas Preining, Laurin Heinrich, Dennis Olsen",Rutronik Racing,Porsche 911 GT3 R (992),2:17.967,342,15.546
6,88,Pro Cup,"Raffaele Marciello, Timur Boguslavskiy, Jules Gounon",AKKODIS ASP Team,Mercedes-AMG GT3,2:18.359,342,37.563
7,71,Pro Cup,"Antonio Fuoco, Davide Rigon, Daniel Serra",AF Corse - Francorchamps Motors,Ferrari 296 GT3,2:18.522,342,40.802
8,11,Pro Cup,"Christopher Haase, Gilles Magnus, Frederic Vervisch",Audi Sport Team Comtoyou,Audi R8 LMS GT3 EVO II,2:18.393,342,45.063
9,5,Gold Cup,"Sam de Haan, Tom Gamble, Charlie Fagg, Dean Macdonald",Optimum Motorsport,McLaren 720S GT3 EVO,2:19.047,342,45.396
10,46,Pro Cup,"Augusto Farfus, Maxime Martin, Valentino Rossi",Team WRT,BMW M4 GT3,2:17.592,342,46.299
11,30,Gold Cup,"Jean-Baptiste Simmenauer, Calan Williams, Niklas Krütten",Team WRT,BMW M4 GT3,2:18.939,342,1:07.475
12,911,Bronze Cup,"Alex Malykhin, Joel Sturm, Marco Seefried, Klaus Bachler",Pure Rxcing,Porsche 911 GT3 R (992),2:18.528,342,1:24.548
13,91,Bronze Cup,"Ralf Bohn, Kay van Berlo, Alfred Renauer, Robert Renauer",Herberth Motorsport,Porsche 911 GT3 R (992),2:18.796,342,1:25.962
14,54,Pro Cup,"Ayhancan Güven, Sven Müller, Christian Engelhart",Dinamic GT Huber Racing,Porsche 911 GT3 R (992),2:18.320,342,1:27.104
15,93,Bronze Cup,"Jeffrey Schmidt, Jonathan Hui, Chris Froggatt, Eddie Cheever",SKY - Tempesta Racing,McLaren 720S GT3 EVO,2:18.627,342,1:28.602
16,21,Gold Cup,"Nicolas Baert, Maxime Soulet, Max Hofer",ComToYou Racing,Audi R8 LMS GT3 EVO II,2:19.167,341,7.395
17,777,Pro Cup,"Lucas Auer, Luca Stolz, Fabian Schiller",Mercedes-AMG Team AlManar,Mercedes-AMG GT3,2:17.813,341,8.175
18,6,Pro Cup,"Sandy Mitchell, Marco Mapelli, Franck Perera",K-Pax Racing,Lamborghini Huracan GT3 EVO 2,2:17.807,341,30.526
19,99,Silver Cup,"Lorenzo Patrese, Pietro Delli Guanti, Alex Aka",Tresor Orange 1,Audi R8 LMS GT3 EVO II,2:18.390,341,49.367
20,20,Bronze Cup,"Antares Au, Tim Heinemann, Jannes Fittje, Matteo Cairoli",Huber Motorsport,Porsche 911 GT3 R (992),2:18.270,341,53.670
21,12,Silver Cup,"Sam Dejonghe, Loris Hezemans, Lucas Legeret, Finlay Hutchison",ComToYou Racing,Audi R8 LMS GT3 EVO II,2:18.857,341,1:02.449
22,25,Pro Cup,"Christopher Mies, Patric Niederhauser, Simon Gachet",Audi Sport Team Sainteloc,Audi R8 LMS GT3 EVO II,2:18.470,341,1:17.976
23,85,Silver Cup,"Clemens Schmid, Benjamin Hites, Glenn van Berlo",GRT Grasser Racing Team,Lamborghini Huracan GT3 EVO 2,2:18.012,341,1:19.836
24,44,Bronze Cup,"Clement Mateu, Frederic Makowiecki, Hugo Chevalier, Steven Palette",CLRT,Porsche 911 GT3 R (992),2:19.148,341,2:02.641
25,66,Bronze Cup,"Andrey Mukovoz, Kikko Galbiati, Sean Hudspeth, Dylan Pereira",Tresor Attempto Racing,Audi R8 LMS GT3 EVO II,2:17.879,340,46.135
26,52,Bronze Cup,"Lilou Wadoux, Louis Machiels, Jef Machiels, Andrea Bertolini",AF Corse,Ferrari 488 GT3,2:20.256,340,1:04.492
27,23,Bronze Cup,"Stephen Grove, Brenton Grove, Anton de Pasquale, Earl Bamber",Grove Racing,Porsche 911 GT3 R (992),2:19.220,340,1:41.214
28,79,Bronze Cup,"Sebastien Baud, Hubert Haupt, Arjun Maini, Jordan Love",Haupt Racing Team,Mercedes-AMG GT3,2:19.313,340,2:01.170
29,35,Bronze Cup,"James Kell, Anders Buchardt, Bailey Voisin, Thomas Neubauer",Walkenhorst Motorsport,BMW M4 GT3,2:19.798,340,2:10.566
30,75,Pro-AM Cup,"Martin Konrad, Adam Osieka, Nicky Catsburg, Chaz Mostert",Sun Energy1 Racing,Mercedes-AMG GT3,2:17.964,339,48.685
31,57,Gold Cup,"Russell Ward, Indy Dontje, Philip Ellis",Winward Racing,Mercedes-AMG GT3,2:18.748,339,1:17.263
32,24,Pro-AM Cup,"Ivan Jacoma, Niki Leutwiler, Alex Fontana, Nico Menzel",Car Collection Motorsport,Porsche 911 GT3 R (992),2:18.823,339,1:22.083
33,55,Bronze Cup,"Philipp Sager, Benjamin Barker, Marius Nakken, Christopher Zöchling",Dinamic GT Huber Racing,Porsche 911 GT3 R (992),2:18.649,339,1:52.345
34,31,Bronze Cup,"Timothy Whale, Adam Carroll, Lewis Proctor",Team WRT,BMW M4 GT3,2:18.365,339,1:53.398
35,888,Pro-AM Cup,"Erwin Creed, Jean Glorieux, Casper Stevenson, Arthur Rougier",CSA Racing,Audi R8 LMS GT3 EVO II,2:18.328,339,2:13.475
36,56,Silver Cup,"Jop Rappange, Adrien De Leener, Tanart Sathienthirakul, Daniele Di Amato",Dinamic GT Huber Racing,Porsche 911 GT3-R (991.II),2:19.912,338,5.251
37,3,Bronze Cup,"Florian Scholze, Kenneth Heyer, Patrick Assenheimer, Alex Peroni",GetSpeed,Mercedes-AMG GT3,2:19.082,338,43.232
38,188,Bronze Cup,"Louis Prette, Miguel Ramos, Conrad Grunewald, Henrique Chaves",Garage 59,McLaren 720S GT3 EVO,2:18.031,338,1:28.867
39,26,Silver Cup,"Erwan Bastard, Paul Evrard, Gregoire Demoustier, Antoine Doquin",Sainteloc Junior Team,Audi R8 LMS GT3 EVO II,2:20.166,338,2:07.417
40,62,Bronze Cup,"Derek Pierce, Xavier Maassen, Andrew James Meyrick, Kiern Jewiss",Team Parker Racing,Porsche 911 GT3 R (992),2:20.269,337,27.848
41,51,Pro Cup,"Alessio Rovera, Robert Shwartzman, Nicklas Nielsen",AF Corse - Francorchamps Motors,Ferrari 296 GT3,2:17.766,335,-13:18.591
42,4,Pro-AM Cup,"George Kurtz, Ian James, Colin Braun, Felipe Fraga",CrowdStrike Racing by Riley,Mercedes-AMG GT3,2:18.822,335,1:18.507
43,89,Bronze Cup,"Adalberto Baptista, Rodrigo Baptista, Alan Hellmeister, Bruno Baptista",AKKODIS ASP Team,Mercedes-AMG GT3,2:20.236,334,49.024
44,9,Gold Cup,"Thomas Laurent, Adam Eteki, Aurelien Panis, Alberto di Folco",Boutsen VDS,Audi R8 LMS GT3 EVO II,2:18.428,334,1:11.276
45,216,Pro-AM Cup,"Francis Tjia, John Shen, Benny Simonsen, Mathias Beche",Modena Motorsports,Porsche 911 GT3 R (992),2:18.988,332,41.141
46,33,Silver Cup,"Jeffrey Kingsley, Jacob Riegel, Romain Leroux, Ruben del Sarte",Bullitt Racing,Aston Martin Vantage GT3,2:20.302,332,2:05.174
47,999,Pro Cup,"Maro Engel, Mikael Grenier, Daniel Juncadella",Mercedes-AMG Team GruppeM Racing,Mercedes-AMG GT3,2:18.074,331,-24:46.211
48,16,Pro-AM Cup,"Junlin Pan, Rio, Xiaole He, Adderly Fong",Uno Racing Team,Audi R8 LMS GT3 EVO II,2:19.675,331,1:08.254
49,50,Bronze Cup,"Julien Piguet, Simon Mann, Nico Varrone, Ulysse De Pauw",AF Corse,Ferrari 296 GT3,2:17.466,328,1:05.222
50,90,Silver Cup,"Magnus Gustavsen, Ezequiel Perez Companc, Alexey Nesov, Jesse Salmenautio",Madpanda Motorsport,Mercedes-AMG GT3,2:19.024,328,1:31.768
51,60,Silver Cup,"Baptiste Moulin, Artem Petrov, Michael Dorrbecker, Marcus Paverud",VSR,Lamborghini Huracan GT3 EVO 2,2:19.477,326,1:53.517
52,64,Pro-AM Cup,"Naveen Rao, Matt Bell, Frank Bird, James Cottingham",Haupt Racing Team,Mercedes-AMG GT3,2:20.902,308,-57:06.714
53,87,Pro Cup,"Lorenzo Ferrari, Thomas Drouet, Maximilian Götz",Mercedes-AMG Team Akkodis ASP,Mercedes-AMG GT3,2:18.355,304,-1:29:50.350
54,19,Gold Cup,"Leonardo Pulcini, Michele Beretta, Rolf Ineichen",Iron Lynx,Lamborghini Huracan GT3 EVO 2,2:18.837,278,-2:01:59.725
55,8,Bronze Cup,"Leonardo Gorini, Antonin Borga, Nicolas Jamin",AGS Events,Lamborghini Huracan GT3 EVO 2,2:19.901,272,-2:21:01.045
56,32,Pro Cup,"Dries Vanthoor, Sheldon van der Linde, Charles Weerts",Team WRT,BMW M4 GT3,2:17.618,250,-4:58:38.848
57,998,Pro Cup,"Daniel Harper, Neil Verhagen, Max Hesse",Rowe Racing,BMW M4 GT3,2:17.988,250,-4:58:38.549
58,157,Gold Cup,"Miklas Born, David Schumacher, Marius Zug",Winward Racing,Mercedes-AMG GT3,2:19.510,238,-4:40:19.322
59,159,Pro Cup,"Marvin Kirchhöfer, Benjamin Goethe, Nicolai Kjaergaard",Garage 59,McLaren 720S GT3 EVO,2:18.251,208,-6:48:28.538
60,81,Bronze Cup,"Reema Juffali, Ralf Aron, Yannick Mettler, Alain Valente",Theeba Motorsport,Mercedes-AMG GT3,2:20.101,200,-7:02:29.104
61,38,Pro-AM Cup,"Samantha Tan, Jon Miller, Isaac Tutumlu Lopez, Leonard Weiss",ST Racing with Rinaldi,Ferrari 296 GT3,2:20.472,192,-6:22:55.212
62,58,Silver Cup,"Fabrizio Crestani, Sam Neary, Gerhard Tweraser, Ricky Capo",GRT Grasser Racing Team,Lamborghini Huracan GT3 EVO 2,2:18.553,188,-7:50:11.632
63,10,Silver Cup,"Loris Cabirou, Cesar Gazeau, Andrea Cola, Roee Meyuhas",Boutsen VDS,Audi R8 LMS GT3 EVO II,2:20.090,186,-6:45:45.935
64,70,Pro-AM Cup,"Gerhard Watzinger, Kerong Li, Jean-Francois Brunot, Brendon Leitch",CrowdStrike Racing by Leipert Motorsport,Lamborghini Huracan GT3 EVO 2,2:19.362,184,-7:02:35.919
65,63,Pro Cup,"Andrea Caldarelli, Jordan Pepper, Mirko Bortolotti",Iron Lynx,Lamborghini Huracan GT3 EVO 2,2:18.542,180,-8:07:15.946
66,78,Pro-AM Cup,"Bashar Mardini, Rob Collard, Patrick Kujala, Dennis Lind",Barwell Motorsport,Lamborghini Huracan GT3 EVO 2,2:18.171,173,-7:43:53.050
67,2,Pro-AM Cup,"Lance Bergstein, Andrzej Lewandowski, Aaron Walker, Lewis Williamson",GetSpeed,Mercedes-AMG GT3,2:20.005,162,-8:45:49.566
68,83,Bronze Cup,"Doriane Pin, Rahel Frey, Sarah Bovy, Michelle Gatting",Iron Dames,Lamborghini Huracan GT3 EVO 2,2:21.056,151,-9:28:18.313
69,7,Bronze Cup,"Brendan Iribe, Oliver Millroy, Fran Rueda, Frederik Schandorff",Inception Racing,McLaren 720S GT3 EVO,2:20.213,74,-12:43:19.782
70,132,Pro-AM Cup,"Kyle Washington, James Sofronas, Patrick Long, Jeroen Bleekemolen",GMG Racing by Car Collection Motorsport,Porsche 911 GT3 R (992),,2,-15:53:13.448
