Pos,Car #,Class,Drivers,Team,Car,Time,Laps,Gap
1,32,Pro Cup,"Dries Vanthoor, Kelvin van der Linde, Charles Weerts",Audi Sport Team WRT,Audi R8 LMS GT3,2:18.787,,
2,188,Pro-AM Cup,"Alexander West, Chris Goodwin, Charlie Eastwood, Marvin Kirchhöfer",Garage 59,Aston Martin Vantage AMR GT3,2:19.139,,0.352
3,34,Pro Cup,"Sheldon van der Linde, David Pittard, Marco Wittmann",Walkenhorst Motorsport,BMW M6 GT3,2:19.170,,0.383
4,22,Pro Cup,"Matt Campbell, Earl Bamber, Mathieu Jaminet",GPX Martini Racing,Porsche 911 GT3-R (991.II),2:19.198,,0.411
5,21,Pro Cup,"Sven Müller, Richard Lietz, Kevin Estre",Rutronik Racing,Porsche 911 GT3-R (991.II),2:19.198,,0.411
6,88,Pro Cup,"Raffaele Marciello, Daniel Juncadella, Jules Gounon",Mercedes-AMG Team Akka ASP,Mercedes-AMG GT3,2:19.202,,0.415
7,107,Silver Cup,"Stuart White, Pierre-Alexandre Jean, Nelson Panciatici, Ulysse De Pauw",CMR,Bentley Continental GT3,2:19.228,,0.441
8,57,Silver Cup,"Russel Ward, Mikael Grenier, Philip Ellis",Winward Racing,Mercedes-AMG GT3,2:19.230,,0.443
9,25,Pro Cup,"Markus Winkelhock, Patric Niederhauser, Christopher Haase",Audi Sport Team Sainteloc Racing,Audi R8 LMS GT3,2:19.283,,0.496
10,38,Pro Cup,"Rob Bell, Oliver Wilkinson, Ben Barnicoat",Jota,McLaren 720S GT3,2:19.312,,0.525
11,89,Pro Cup,"Lucas Auer, Timur Boguslavskiy, Felipe Fraga",AKKA ASP,Mercedes-AMG GT3,2:19.321,,0.534
12,2,Pro-AM Cup,"Nico Bastian, Florian Scholze, Olivier Grotz, Jim Pla",GetSpeed,Mercedes-AMG GT3,2:19.448,,0.661
13,71,Pro Cup,"Antonio Fuoco, Callum Ilott, Davide Rigon",Iron Lynx,Ferrari 488 GT3,2:19.456,,0.669
14,37,Pro Cup,"Nico Müller, Robin Frijns, Dennis Lind",Audi Sport Team WRT,Audi R8 LMS GT3,2:19.555,,0.768
15,51,Pro Cup,"Come Ledogar, Nicklas Nielsen, Alessandro Pier Guidi",Iron Lynx,Ferrari 488 GT3,2:19.573,,0.786
16,35,Pro Cup,"Timo Glock, Martin Tomczyk, Thomas Neubauer",Walkenhorst Motorsport,BMW M6 GT3,2:19.587,,0.800
17,911,Pro-AM Cup,"Antares Au, Daniel Allemann, Alfred Renauer, Robert Renauer",Herberth Motorsport,Porsche 911 GT3-R (991.II),2:19.702,,0.915
18,66,Pro Cup,"Mattia Drudi, Dennis Marschall, Christopher Mies",Audi Sport Team Attempto Racing,Audi R8 LMS GT3,2:19.729,,0.942
19,47,Pro Cup,"Maxime Martin, Nick Tandy, Laurens Vanthoor",KCMG,Porsche 911 GT3-R (991.II),2:19.749,,0.962
20,95,Pro Cup,"Nicki Thiim, Ross Gunn, Marco Sorensen",Garage 59,Aston Martin Vantage AMR GT3,2:19.800,,1.013
21,99,Silver Cup,"Fabien Lavergne, Max Hofer, Alex Aka",Attempto Racing,Audi R8 LMS GT3,2:19.826,,1.039
22,93,Pro-AM Cup,"Jonathan Hui, Chris Froggatt, Matteo Cressoni, Edward Cheever",SKY - Tempesta Racing,Ferrari 488 GT3,2:19.828,,1.041
23,30,Silver Cup,"James Pull, Franco Colapinto, Benjamin Goethe",Team WRT,Audi R8 LMS GT3,2:19.869,,1.082
24,16,Silver Cup,"Alberto di Folco, Tim Zimmermann, Kikko Galbiati, Clemens Schmid",GRT Grasser Racing Team,Lamborghini Huracan GT3 Evo,2:19.880,,1.093
25,87,Silver Cup,"Simon Gachet, Konstantin Tereschenko, Petru Razvan Umbrarescu, Thomas Drouet",AKKA ASP,Mercedes-AMG GT3,2:19.890,,1.103
26,14,Silver Cup,"Alex Fontana, Rolf Ineichen, Ricardo Feller",Emil Frey Racing,Lamborghini Huracan GT3 Evo,2:19.944,,1.157
27,4,Pro Cup,"Maro Engel, Luca Stolz, Vincent Abril",Mercedes-AMG Team HRT,Mercedes-AMG GT3,2:19.971,,1.184
28,69,Pro-AM Cup,"Sam de Haan, Rob Collard, Ricky Collard Jr., Fabian Schiller",Ram Racing,Mercedes-AMG GT3,2:20.053,,1.266
29,20,Pro-AM Cup,"Valentin Pierburg, George Kurtz, Colin Braun, Dominik Baumann",SPS automotive performance,Mercedes-AMG GT3,2:20.094,,1.307
30,40,Silver Cup,"Miklas Born, Jordan Love, Yannick Mettler, Lance David Arnold",SPS automotive performance,Mercedes-AMG GT3,2:20.132,,1.345
31,33,Silver Cup,"Benja Hites, Fabrizio Crestani, David Perel",Team Rinaldi Racing,Ferrari 488 GT3,2:20.206,,1.419
32,31,Silver Cup,"Ryuichiro Tomita, Frank Bird, Valdemar Eriksen",Team WRT,Audi R8 LMS GT3,2:20.270,,1.483
33,159,Silver Cup,"Tuomas Tujula, Alex MacDowall, Valentin Hasse Clot, Nicolai Kjaergaard",Garage 59,Aston Martin Vantage AMR GT3,2:20.318,,1.531
34,56,Pro Cup,"Romain Dumas, Andrea Rizzoli, Mikkel O. Pedersen",Dinamic Motorsport,Porsche 911 GT3-R (991.II),2:20.394,,1.607
35,10,Pro-AM Cup,"Jens Liebhauser, Karim Ojjeh, Yann Zimmer, Jens Klingmann",Boutsen Ginion,BMW M6 GT3,2:20.420,,1.633
36,7,Silver Cup,"Berkay Besler, Oscar Tunjo, Paul Petit, Marvin Dienst",Toksport WRT,Mercedes-AMG GT3,2:20.475,,1.688
37,3,Pro Cup,"Dennis Olsen, Michael Christensen, Frederic Makowiecki",Schnabl Engineering,Porsche 911 GT3-R (991.II),2:20.503,,1.716
38,18,Pro Cup,"Edoardo Liberati, Alexandre Imperatori, Joshua Burdon",KCMG,Porsche 911 GT3-R (991.II),2:20.530,,1.743
39,53,Pro-AM Cup,"Duncan Cameron, Rino Mastronardi, Matt Griffin, Miguel Molina",AF Corse,Ferrari 488 GT3,2:20.634,,1.847
40,70,Pro-AM Cup,"Oliver Millroy, Brendan Iribe, Kevin Madsen, Jordan Pepper",Inception Racing,McLaren 720S GT3,2:20.743,,1.956
41,26,Pro Cup,"Jamie Green, Finlay Hutchison, Adrien Tambay",Sainteloc Racing,Audi R8 LMS GT3,2:20.756,,1.969
42,90,Silver Cup,"Ezequiel Perez Companc, Ricardo Sanchez, Patrick Kujala, Rik Breukers",Madpanda Motorsport,Mercedes-AMG GT3,2:20.812,,2.025
43,63,Pro Cup,"Mirko Bortolotti, Marco Mapelli, Andrea Caldarelli",Orange 1 FFF Racing Team,Lamborghini Huracan GT3 Evo,2:20.862,,2.075
44,666,Silver Cup,"Martin Rump, Glenn van Berlo, Baptiste Moulin, Yuki Nemoto",VS Racing,Lamborghini Huracan GT3 Evo,2:20.962,,2.175
45,27,Silver Cup,"Alexandre Cougnaud, Lucas Legeret, Louis Prette, Aurelien Panis",Sainteloc Racing,Audi R8 LMS GT3,2:20.991,,2.204
46,54,Pro Cup,"Klaus Bachler, Christian Engelhart, Matteo Cairoli",Dinamic Motorsport,Porsche 911 GT3-R (991.II),2:21.020,,2.233
47,163,Pro Cup,"Giacomo Altoe, Franck Perera, Albert Costa",Emil Frey Racing,Lamborghini Huracan GT3 Evo,2:21.147,,2.360
48,52,Pro-AM Cup,"Louis Machiels, John Wartique, Andrea Bertolini, Alessio Rovera",AF Corse,Ferrari 488 GT3,2:21.220,,2.433
49,5,Silver Cup,"Michele Beretta, Hubert Haupt, Patrick Assenheimer, Indy Dontje",HRT,Mercedes-AMG GT3,2:21.223,,2.436
50,19,Pro-AM Cup,"Bertrand Baguette, Hiroshi Hamaguchi, Stefano Costantini, Phil Keen",Orange 1 FFF Racing Team,Lamborghini Huracan GT3 Evo,2:21.248,,2.461
51,11,Pro-AM Cup,"Tim Kohmann, Francesco Zollo, Giorgio Roda, David Fumanelli",Kessel Racing,Ferrari 488 GT3,2:21.349,,2.562
52,77,Pro-AM Cup,"Miguel Ramos, Leo Machitski, Henrique Chaves, Sandy Mitchell",Barwell Motorsport,Lamborghini Huracan GT3 Evo,2:21.566,,2.779
53,222,Silver Cup,"Lars Kern, Bastian Buus, Julien Apotheloz, Arno Santamato",Team Allied Racing,Porsche 911 GT3-R (991.II),2:21.674,,2.887
54,23,AM Cup,"Jacob Schell, Ivan Jacoma, Niki Leutwiler, Nico Menzel",Huber Motorsport,Porsche 911 GT3-R (991.II),2:21.760,,2.973
55,114,Pro Cup,"Konsta Lappalainen, Jack Aitken, Arthur Rougier",Emil Frey Racing,Lamborghini Huracan GT3 Evo,2:21.840,,3.053
56,166,AM Cup,"Pieder Decurtins, Dennis Busch, Manuel Lauck, Marc Basseng",Haegeli by T2 Racing,Porsche 911 GT3-R (991.II),2:21.983,,3.196
57,61,Pro-AM Cup,"Adrian Henry de Silva, Carlos Rivas, Reid Harker, Will Bamber",EBM Giga Racing,Porsche 911 GT3-R (991.II),2:23.300,,4.513
58,50,Pro Cup,"Nicky Catsburg, Maxi Buhk, Maxi Götz",Hub Auto,Mercedes-AMG GT3,2:25.161,,6.374
