Pos,Car #,Class,Drivers,Team,Car,Time,Laps,Gap
1,88,Pro Cup,"Raffaele Marciello, Daniel Juncadella, Jules Gounon",Mercedes-AMG Team Akka ASP,Mercedes-AMG GT3,2:18.323,,
2,95,Pro Cup,"Nicki Thiim, Ross Gunn, Marco Sorensen",Garage 59,Aston Martin Vantage AMR GT3,2:18.327,,0.004
3,107,Silver Cup,"Stuart White, Pierre-Alexandre Jean, Nelson Panciatici, Ulysse De Pauw",CMR,Bentley Continental GT3,2:18.905,,0.582
4,4,Pro Cup,"Maro Engel, Luca Stolz, Vincent Abril",Mercedes-AMG Team HRT,Mercedes-AMG GT3,2:19.138,,0.815
5,87,Silver Cup,"Simon Gachet, Konstantin Tereschenko, Petru Razvan Umbrarescu, Thomas Drouet",AKKA ASP,Mercedes-AMG GT3,2:19.231,,0.908
6,34,Pro Cup,"Sheldon van der Linde, David Pittard, Marco Wittmann",Walkenhorst Motorsport,BMW M6 GT3,2:19.304,,0.981
7,163,Pro Cup,"Giacomo Altoe, Franck Perera, Albert Costa",Emil Frey Racing,Lamborghini Huracan GT3 Evo,2:19.338,,1.015
8,35,Pro Cup,"Timo Glock, Martin Tomczyk, Thomas Neubauer",Walkenhorst Motorsport,BMW M6 GT3,2:19.462,,1.139
9,31,Silver Cup,"Ryuichiro Tomita, Frank Bird, Valdemar Eriksen",Team WRT,Audi R8 LMS GT3,2:19.570,,1.247
10,66,Pro Cup,"Mattia Drudi, Dennis Marschall, Christopher Mies",Audi Sport Team Attempto Racing,Audi R8 LMS GT3,2:19.571,,1.248
11,63,Pro Cup,"Mirko Bortolotti, Marco Mapelli, Andrea Caldarelli",Orange 1 FFF Racing Team,Lamborghini Huracan GT3 Evo,2:19.609,,1.286
12,89,Pro Cup,"Lucas Auer, Timur Boguslavskiy, Felipe Fraga",AKKA ASP,Mercedes-AMG GT3,2:19.728,,1.405
13,22,Pro Cup,"Matt Campbell, Earl Bamber, Mathieu Jaminet",GPX Martini Racing,Porsche 911 GT3-R (991.II),2:19.744,,1.421
14,14,Silver Cup,"Alex Fontana, Rolf Ineichen, Ricardo Feller",Emil Frey Racing,Lamborghini Huracan GT3 Evo,2:19.982,,1.659
15,71,Pro Cup,"Antonio Fuoco, Callum Ilott, Davide Rigon",Iron Lynx,Ferrari 488 GT3,2:20.028,,1.705
16,114,Pro Cup,"Konsta Lappalainen, Jack Aitken, Arthur Rougier",Emil Frey Racing,Lamborghini Huracan GT3 Evo,2:20.101,,1.778
17,51,Pro Cup,"Come Ledogar, Nicklas Nielsen, Alessandro Pier Guidi",Iron Lynx,Ferrari 488 GT3,2:20.102,,1.779
18,30,Silver Cup,"James Pull, Franco Colapinto, Benjamin Goethe",Team WRT,Audi R8 LMS GT3,2:20.188,,1.865
19,40,Silver Cup,"Miklas Born, Jordan Love, Yannick Mettler, Lance David Arnold",SPS automotive performance,Mercedes-AMG GT3,2:20.202,,1.879
20,27,Silver Cup,"Alexandre Cougnaud, Lucas Legeret, Louis Prette, Aurelien Panis",Sainteloc Racing,Audi R8 LMS GT3,2:20.244,,1.921
21,38,Pro Cup,"Rob Bell, Oliver Wilkinson, Ben Barnicoat",Jota,McLaren 720S GT3,2:20.248,,1.925
22,37,Pro Cup,"Nico Müller, Robin Frijns, Dennis Lind",Audi Sport Team WRT,Audi R8 LMS GT3,2:20.291,,1.968
23,56,Pro Cup,"Romain Dumas, Andrea Rizzoli, Mikkel O. Pedersen",Dinamic Motorsport,Porsche 911 GT3-R (991.II),2:20.371,,2.048
24,7,Silver Cup,"Berkay Besler, Oscar Tunjo, Paul Petit, Marvin Dienst",Toksport WRT,Mercedes-AMG GT3,2:20.417,,2.094
25,47,Pro Cup,"Maxime Martin, Nick Tandy, Laurens Vanthoor",KCMG,Porsche 911 GT3-R (991.II),2:20.516,,2.193
26,54,Pro Cup,"Klaus Bachler, Christian Engelhart, Matteo Cairoli",Dinamic Motorsport,Porsche 911 GT3-R (991.II),2:20.530,,2.207
27,26,Pro Cup,"Jamie Green, Finlay Hutchison, Adrien Tambay",Sainteloc Racing,Audi R8 LMS GT3,2:20.663,,2.340
28,25,Pro Cup,"Markus Winkelhock, Patric Niederhauser, Christopher Haase",Audi Sport Team Sainteloc Racing,Audi R8 LMS GT3,2:20.665,,2.342
29,18,Pro Cup,"Edoardo Liberati, Alexandre Imperatori, Joshua Burdon",KCMG,Porsche 911 GT3-R (991.II),2:20.903,,2.580
30,3,Pro Cup,"Dennis Olsen, Michael Christensen, Frederic Makowiecki",Schnabl Engineering,Porsche 911 GT3-R (991.II),2:21.075,,2.752
31,188,Pro-AM Cup,"Alexander West, Chris Goodwin, Charlie Eastwood, Marvin Kirchhöfer",Garage 59,Aston Martin Vantage AMR GT3,2:21.526,,3.203
32,33,Silver Cup,"Benja Hites, Fabrizio Crestani, David Perel",Team Rinaldi Racing,Ferrari 488 GT3,2:21.563,,3.240
33,21,Pro Cup,"Sven Müller, Richard Lietz, Kevin Estre",Rutronik Racing,Porsche 911 GT3-R (991.II),2:21.685,,3.362
34,93,Pro-AM Cup,"Jonathan Hui, Chris Froggatt, Matteo Cressoni, Edward Cheever",SKY - Tempesta Racing,Ferrari 488 GT3,2:21.729,,3.406
35,666,Silver Cup,"Martin Rump, Glenn van Berlo, Baptiste Moulin, Yuki Nemoto",VS Racing,Lamborghini Huracan GT3 Evo,2:21.760,,3.437
36,99,Silver Cup,"Fabien Lavergne, Max Hofer, Alex Aka",Attempto Racing,Audi R8 LMS GT3,2:22.002,,3.679
37,222,Silver Cup,"Lars Kern, Bastian Buus, Julien Apotheloz, Arno Santamato",Team Allied Racing,Porsche 911 GT3-R (991.II),2:22.116,,3.793
38,2,Pro-AM Cup,"Nico Bastian, Florian Scholze, Olivier Grotz, Jim Pla",GetSpeed,Mercedes-AMG GT3,2:22.132,,3.809
39,90,Silver Cup,"Ezequiel Perez Companc, Ricardo Sanchez, Patrick Kujala, Rik Breukers",Madpanda Motorsport,Mercedes-AMG GT3,2:22.156,,3.833
40,57,Silver Cup,"Russel Ward, Mikael Grenier, Philip Ellis",Winward Racing,Mercedes-AMG GT3,2:22.253,,3.930
41,10,Pro-AM Cup,"Jens Liebhauser, Karim Ojjeh, Yann Zimmer, Jens Klingmann",Boutsen Ginion,BMW M6 GT3,2:22.301,,3.978
42,5,Silver Cup,"Michele Beretta, Hubert Haupt, Patrick Assenheimer, Indy Dontje",HRT,Mercedes-AMG GT3,2:22.358,,4.035
43,69,Pro-AM Cup,"Sam de Haan, Rob Collard, Ricky Collard Jr., Fabian Schiller",Ram Racing,Mercedes-AMG GT3,2:22.434,,4.111
44,50,Pro Cup,"Nicky Catsburg, Maxi Buhk, Maxi Götz",Hub Auto,Mercedes-AMG GT3,2:22.487,,4.164
45,77,Pro-AM Cup,"Miguel Ramos, Leo Machitski, Henrique Chaves, Sandy Mitchell",Barwell Motorsport,Lamborghini Huracan GT3 Evo,2:22.858,,4.535
46,159,Silver Cup,"Tuomas Tujula, Alex MacDowall, Valentin Hasse Clot, Nicolai Kjaergaard",Garage 59,Aston Martin Vantage AMR GT3,2:23.109,,4.786
47,53,Pro-AM Cup,"Duncan Cameron, Rino Mastronardi, Matt Griffin, Miguel Molina",AF Corse,Ferrari 488 GT3,2:23.429,,5.106
48,166,AM Cup,"Pieder Decurtins, Dennis Busch, Manuel Lauck, Marc Basseng",Haegeli by T2 Racing,Porsche 911 GT3-R (991.II),2:23.986,,5.663
49,911,Pro-AM Cup,"Antares Au, Daniel Allemann, Alfred Renauer, Robert Renauer",Herberth Motorsport,Porsche 911 GT3-R (991.II),2:24.288,,5.965
50,19,Pro-AM Cup,"Bertrand Baguette, Hiroshi Hamaguchi, Stefano Costantini, Phil Keen",Orange 1 FFF Racing Team,Lamborghini Huracan GT3 Evo,2:24.304,,5.981
51,23,AM Cup,"Jacob Schell, Ivan Jacoma, Niki Leutwiler, Nico Menzel",Huber Motorsport,Porsche 911 GT3-R (991.II),2:24.488,,6.165
52,52,Pro-AM Cup,"Louis Machiels, John Wartique, Andrea Bertolini, Alessio Rovera",AF Corse,Ferrari 488 GT3,2:24.545,,6.222
53,70,Pro-AM Cup,"Oliver Millroy, Brendan Iribe, Kevin Madsen, Jordan Pepper",Inception Racing,McLaren 720S GT3,2:25.145,,6.822
54,20,Pro-AM Cup,"Valentin Pierburg, George Kurtz, Colin Braun, Dominik Baumann",SPS automotive performance,Mercedes-AMG GT3,2:25.818,,7.495
55,11,Pro-AM Cup,"Tim Kohmann, Francesco Zollo, Giorgio Roda, David Fumanelli",Kessel Racing,Ferrari 488 GT3,2:26.261,,7.938
56,61,Pro-AM Cup,"Adrian Henry de Silva, Carlos Rivas, Reid Harker, Will Bamber",EBM Giga Racing,Porsche 911 GT3-R (991.II),2:27.617,,9.294
NC,16,Silver Cup,"Alberto di Folco, Tim Zimmermann, Kikko Galbiati, Clemens Schmid",GRT Grasser Racing Team,Lamborghini Huracan GT3 Evo,,,
NC,32,Pro Cup,"Dries Vanthoor, Kelvin van der Linde, Charles Weerts",Audi Sport Team WRT,Audi R8 LMS GT3,,,
