Pos,Car #,Class,Drivers,Team,Car,Time,Laps,Gap
1,63,Pro Cup,"Mirko Bortolotti, Jack Aitken, Albert Costa",Emil Frey Racing,Lamborghini Huracan GT3 Evo,1:55.576,15,
2,54,Pro Cup,"Klaus Bachler, Come Ledogar, Matteo Cairoli",Dinamic Motorsport,Porsche 911 GT3-R (991.II),1:55.626,15,0.880
3,88,Pro Cup,"Raffaele Marciello, Daniel Juncadella, Jules Gounon",AMG Team AKKODIS ASP,Mercedes-AMG GT3,1:55.589,15,1.206
4,71,Pro Cup,"Daniel Serra, Davide Rigon, Antonio Fuoco",Iron Lynx,Ferrari 488 GT3,1:55.851,15,1.653
5,32,Pro Cup,"Dries Vanthoor, Kelvin van der Linde, Charles Weerts",Team WRT,Audi R8 LMS evo II GT3,1:55.797,15,2.511
6,30,Silver Cup,"Jean-Baptiste Simmenauer, Benjamin Goethe, Thomas Neubauer",Team WRT,Audi R8 LMS evo II GT3,1:55.861,15,2.892
7,51,Pro Cup,"Nicklas Nielsen, James Calado, Miguel Molina",Iron Lynx,Ferrari 488 GT3,1:55.744,15,3.358
8,38,Pro Cup,"Marvin Kirchhöfer, Oliver Wilkinson, Rob Bell",Jota,McLaren 720S GT3,1:55.706,15,5.474
9,14,Silver Cup,"Konsta Lappalainen, Tuomas Tujula, Stuart White",Emil Frey Racing,Lamborghini Huracan GT3 Evo,1:55.762,15,6.202
10,46,Pro Cup,"Frederic Vervisch, Nico Müller, Valentino Rossi",Team WRT,Audi R8 LMS evo II GT3,1:56.001,15,7.505
11,19,Pro Cup,"Leo Roussel, Arthur Rougier, Giacomo Altoe",Emil Frey Racing,Lamborghini Huracan GT3 Evo,1:55.467,15,8.029
12,98,Pro Cup,"Nick Yelloly, Nicky Catsburg, Augusto Farfus",Rowe Racing,BMW M4 GT3,1:55.790,15,8.814
13,95,Pro Cup,"Maxime Martin, Marco Sorensen, Nicki Thiim",Beechdean AMR,Aston Martin Vantage AMR GT3,1:55.762,15,9.900
14,57,Gold Cup,"Jens Liebhauser, Lorenzo Ferrari, Lucas Auer",Winward Racing,Mercedes-AMG GT3,1:56.094,15,11.815
15,12,Pro Cup,"Christopher Haase, Mattia Drudi, Luca Ghiotto",Tresor by Car Collection,Audi R8 LMS evo II GT3,1:56.163,15,13.822
16,87,Silver Cup,"Casper Stevenson, Thomas Drouet, Tommaso Mosca",AKKODIS ASP,Mercedes-AMG GT3,1:56.318,15,14.338
17,777,Silver Cup,"Al Faisal Al Zubair, Axcil Jefferies, Fabian Schiller",Al Manar Racing by HRT,Mercedes-AMG GT3,1:56.263,15,15.074
18,66,Pro Cup,"Juuso Puhakka, Markus Winkelhock, Dennis Marschall",Attempto Racing,Audi R8 LMS evo II GT3,1:56.184,15,15.631
19,111,Pro Cup,"Christian Klien, Vincent Abril, Dennis Lind",JP Motorsport,McLaren 720S GT3,1:55.989,15,17.437
20,99,Silver Cup,"Marius Zug, Nicolas Schöll, Alex Aka",Attempto Racing,Audi R8 LMS evo II GT3,1:56.268,15,18.137
21,25,Pro Cup,"Lucas Legeret, Christopher Mies, Patric Niederhauser",Sainteloc Junior Team,Audi R8 LMS evo II GT3,1:56.147,15,21.146
22,50,Pro Cup,"Daniel Harper, Neil Verhagen, Max Hesse",Rowe Racing,BMW M4 GT3,1:56.034,15,25.529
23,31,Silver Cup,"Finlay Hutchison, Diego Menchaca, Louis Proctor",Team WRT,Audi R8 LMS evo II GT3,1:56.703,15,29.459
24,4,Silver Cup,"Jannes Fittje, Alain Valente, Jordan Love",Haupt Racing Team,Mercedes-AMG GT3,1:56.950,15,31.381
25,911,Gold Cup,"Ralf Bohn, Alfred Renauer, Robert Renauer",Herberth Motorsport,Porsche 911 GT3-R (991.II),1:57.045,15,32.176
26,188,Pro-AM Cup,"Alexander West, Miguel Ramos, Henrique Chaves",Garage 59,McLaren 720S GT3,1:56.873,15,32.519
27,7,Gold Cup,"Oliver Millroy, Brendan Iribe, Frederik Schandorff",Inception Racing,McLaren 720S GT3,1:57.025,15,35.670
28,26,Silver Cup,"Cesar Gazeau, Nicolas Baert, Aurelien Panis",Sainteloc Junior Team,Audi R8 LMS evo II GT3,1:57.161,15,36.020
29,22,Silver Cup,"Patrik Matthiesen, Dominik Fischli, Joel Sturm",Allied Racing,Porsche 911 GT3-R (991.II),1:56.087,15,36.322
30,56,Silver Cup,"Mauro Calamia, Marius Nakken, Giorgio Roda",Dinamic Motorsport,Porsche 911 GT3-R (991.II),1:56.459,15,37.092
31,10,Gold Cup,"Adam Eteki, Karim Ojjeh, Benjamin Lessennes",Boutsen Racing,Audi R8 LMS evo II GT3,1:56.219,15,37.193
32,93,Gold Cup,"Eddie Cheever, Chris Froggatt, Jonathan Hui",SKY - Tempesta Racing,Mercedes-AMG GT3,1:56.999,15,38.601
33,77,Gold Cup,"Sandy Mitchell, Rob Collard, Alex MacDowall",Barwell Motorsport,Lamborghini Huracan GT3 Evo,1:57.113,15,39.515
34,83,Gold Cup,"Rahel Frey, Sarah Bovy, Michelle Gatting",Iron Dames,Ferrari 488 GT3,1:56.772,15,39.906
35,163,Silver Cup,"Marcus Paverud, Baptiste Moulin, Michael Dörrbecker",VSR,Lamborghini Huracan GT3 Evo,1:56.624,15,41.156
36,90,Silver Cup,"Sean Walkinshaw, Franco Girolami, Ezequiel Perez Companc",Madpanda Motorsport,Mercedes-AMG GT3,1:56.870,15,41.849
37,97,Gold Cup,"Valentin Hasse Clot, Theo Nouet, Andrew Howard",Beechdean AMR,Aston Martin Vantage AMR GT3,1:56.221,15,42.165
38,20,Pro-AM Cup,"Dominik Baumann, Valentin Pierburg, Martin Konrad",SPS automotive performance,Mercedes-AMG GT3,1:57.109,15,42.686
39,33,Gold Cup,"Ryuichiro Tomita, Arnold Robin, Maxime Robin",Team WRT,Audi R8 LMS evo II GT3,1:57.004,15,42.852
40,52,Pro-AM Cup,"Stefano Costantini, Louis Machiels, Andrea Bertolini",AF Corse,Ferrari 488 GT3,1:57.945,15,48.132
41,3,Silver Cup,"Sebastien Baud, Valdemar Eriksen, Jeff Kingsley",GetSpeed,Mercedes-AMG GT3,1:57.268,15,52.068
42,27,Silver Cup,"Taylor Cooke, Brandon Leitch, Isaac Tutumlu Lopez",Leipert Motorsport,Lamborghini Huracan GT3 Evo,1:57.297,15,53.074
43,39,Gold Cup,"Piti Bhirombhakdi, Tanard Sathienthirakul, Matthew Payne",Singha Racing Team TP 12,Porsche 911 GT3-R (991.II),1:56.947,15,54.283
44,11,Silver Cup,"Lorenzo Patrese, Hugo Valente, Axel Blom",Tresor by Car Collection,Audi R8 LMS evo II GT3,1:56.826,15,55.350
45,112,Gold Cup,"Maciej Blazek, Joe Osborne, Patryk Krupinski",JP Motorsport,McLaren 720S GT3,1:57.218,15,56.126
46,24,Pro-AM Cup,"Niki Leutwiler, Ivan Jacoma, Alessio Picariello",Herberth Motorsport,Porsche 911 GT3-R (991.II),1:57.843,15,57.538
47,8,Gold Cup,"Nicolas Gomar, Loris Cabirou, Mike Parisy",AGS Events,Lamborghini Huracan GT3 Evo,1:57.874,15,1:00.296
48,91,Gold Cup,"Alex Malykhin, James Dorlin, Ben Barker",Allied Racing,Porsche 911 GT3-R (991.II),1:57.501,15,1:01.958
49,21,Gold Cup,"Hugo Delacour, Cedric Sbirrazzuoli, Alessandro Balzan",AF Corse,Ferrari 488 GT3,1:57.703,15,1:02.250
50,2,Pro Cup,"Maro Engel, Steijn Schothorst, Luca Stolz",AMG Team GetSpeed,Mercedes-AMG GT3,1:55.766,13,1:13.427
NC,159,Silver Cup,"Vargas Manuel Maldonado, Ethan Simioni, Nicolai Kjaergaard",Garage 59,McLaren 720S GT3,,,
NC,5,Gold Cup,"Arjun Maini, Hubert Haupt, Florian Scholze",Haupt Racing Team,Mercedes-AMG GT3,,,
