Pos,Car #,Class,Drivers,Team,Car,Time,Laps,Gap
1,63,Pro Cup,"Mirko Bortolotti, Marco Mapelli, Andrea Caldarelli",Orange 1 FFF Racing Team,Lamborghini Huracan GT3 Evo,1:54.895,135,
2,34,Pro Cup,"Sheldon van der Linde, Marco Wittmann, David Pittard",Walkenhorst Motorsport,BMW M6 GT3,1:54.607,135,2.967
3,22,Pro Cup,"Matt Campbell, Earl Bamber, Mathieu Jaminet",GPX,Porsche 911 GT3-R (991.II),1:54.848,135,3.198
4,71,Pro Cup,"Antonio Fuoco, Callum Ilott, Davide Rigon",Iron Lynx,Ferrari 488 GT3,1:54.845,135,3.855
5,32,Pro Cup,"Dries Vanthoor, Kelvin van der Linde, Charles Weerts",Team WRT,Audi R8 LMS GT3,1:55.020,135,7.517
6,51,Pro Cup,"Alessandro Pier Guidi, Nicklas Nielsen, Come Ledogar",Iron Lynx,Ferrari 488 GT3,1:54.964,135,7.888
7,35,Pro Cup,"Timo Glock, Martin Tomczyk, Thomas Neubauer",Walkenhorst Motorsport,BMW M6 GT3,1:55.028,135,19.840
8,54,Pro Cup,"Matteo Cairoli, Klaus Bachler, Christian Engelhart",Dinamic Motorsport,Porsche 911 GT3-R (991.II),1:55.029,135,21.458
9,26,Pro Cup,"Markus Winkelhock, Finlay Hutchison, Frederic Vervisch",Sainteloc Racing,Audi R8 LMS GT3,1:54.818,135,21.698
10,163,Pro Cup,"Giacomo Altoe, Norbert Siedler, Albert Costa",Emil Frey Racing,Lamborghini Huracan GT3 Evo,1:55.001,135,30.922
11,88,Pro Cup,"Raffaele Marciello, Daniel Juncadella, Jules Gounon",AKKA ASP,Mercedes-AMG GT3,1:55.027,135,33.510
12,87,Silver Cup,"Simon Gachet, Thomas Drouet, Konstantin Tereschenko",AKKA ASP,Mercedes-AMG GT3,1:55.248,135,39.523
13,56,Pro Cup,"Romain Dumas, Andrea Rizzoli, Mikkel O. Pedersen",Dinamic Motorsport,Porsche 911 GT3-R (991.II),1:55.395,135,1:34.010
14,14,Silver Cup,"Alex Fontana, Rolf Ineichen, Ricardo Feller",Emil Frey Racing,Lamborghini Huracan GT3 Evo,1:55.473,135,1:41.333
15,38,Pro Cup,"Rob Bell, Oliver Wilkinson, Ben Barnicoat",JOTA,McLaren 720S GT3,1:55.057,134,8.466
16,4,Pro Cup,"Maro Engel, Luca Stolz, Vincent Abril",HRT,Mercedes-AMG GT3,1:55.418,134,20.579
17,66,Pro Cup,"Christopher Mies, Mattia Drudi, Kim Luis Schramm",Attempto Racing,Audi R8 LMS GT3,1:55.983,134,30.258
18,25,Pro Cup,"Adrien Tambay, Alexandre Cougnaud, Christopher Haase",Sainteloc Racing,Audi R8 LMS GT3,1:55.061,134,36.174
19,16,Silver Cup,"Tim Zimmermann, Kikko Galbiati, Clemens Schmid",GRT Grasser Racing Team,Lamborghini Huracan GT3 Evo,1:55.986,134,39.176
20,99,Silver Cup,"Dennis Marschall, Alex Aka, Max Hofer",Attempto Racing,Audi R8 LMS GT3,1:55.840,134,42.565
21,159,Silver Cup,"Valentin Hasse Clot, Nicolai Kjaergaard, Alex MacDowall",Garage 59,Aston Martin Vantage AMR GT3,1:55.451,134,50.124
22,19,Pro-AM Cup,"Phil Keen, Hiroshi Hamaguchi",Orange 1 FFF Racing Team,Lamborghini Huracan GT3 Evo,1:55.560,134,55.500
23,30,Silver Cup,"James Pull, Stuart Hall, Benjamin Goethe",Team WRT,Audi R8 LMS GT3,1:55.623,133,7.177
24,57,Silver Cup,"Russel Ward, Mikael Grenier, Philip Ellis",Winward Racing,Mercedes-AMG GT3,1:55.169,133,7.238
25,5,Silver Cup,"Gabriele Piana, Patrick Assenheimer, Hubert Haupt",HRT,Mercedes-AMG GT3,1:55.801,133,26.531
26,93,Pro-AM Cup,"Chris Froggatt, Jonathan Hui, Edward Cheever",SKY - Tempesta Racing,Ferrari 488 GT3,1:56.131,133,31.972
27,90,Silver Cup,"Ezequiel Perez Companc, Ricardo Sanchez, Rik Breukers",Madpanda Motorsport,Mercedes-AMG GT3,1:55.558,133,40.950
28,188,Pro-AM Cup,"Chris Goodwin, Alexander West, Jonny Adam",Garage 59,Aston Martin Vantage AMR GT3,1:55.672,133,48.252
29,69,Pro-AM Cup,"Rob Collard, Sam de Haan, Fabian Schiller",Ram Racing,Mercedes-AMG GT3,1:56.093,133,53.384
30,20,Pro-AM Cup,"Martin Konrad, Valentin Pierburg, Dominik Baumann",SPS automotive performance,Mercedes-AMG GT3,1:56.536,132,23.093
31,111,Pro Cup,"Patryk Krupinski, Karol Bascz, Christian Klien",JP Motorsport,McLaren 720S GT3,1:55.417,132,31.523
32,83,Pro-AM Cup,"Sarah Bovy, Doriane Pin, Katherine Legge",Iron Lynx,Ferrari 488 GT3,1:56.927,132,44.237
33,11,Pro-AM Cup,"Tim Kohmann, Francesco Zollo, Giorgio Roda",Kessel Racing,Ferrari 488 GT3,1:56.370,131,0.555
34,24,Silver Cup,"Milan Dontje, Patrick Kolb, Simon Reicher",Car Collection,Audi R8 LMS GT3,1:57.988,131,42.305
35,10,Pro-AM Cup,"Karim Ojjeh, Jens Liebhauser, Jens Klingmann",Boutsen Ginion,BMW M6 GT3,1:56.432,131,58.541
36,114,Pro Cup,"Konsta Lappalainen, Jack Aitken, Arthur Rougier",Emil Frey Racing,Lamborghini Huracan GT3 Evo,1:54.790,130,1:36.104
37,70,Pro-AM Cup,"Oliver Millroy, Brendan Iribe, Nick Moss",Inception Racing,McLaren 720S GT3,1:56.256,127,51.924
38,222,Pro-AM Cup,"Jan Kasperlik, Julien Apotheloz, Nicolas Schöll",Team Allied Racing,Porsche 911 GT3-R (991.II),1:55.871,127,1:49.698
39,40,Silver Cup,"Miklas Born, Yannick Mettler, Jordan Love",SPS automotive performance,Mercedes-AMG GT3,1:55.793,119,-3:00.694
40,2,Pro-AM Cup,"Nico Bastian, Olivier Grotz, Florian Scholze",GetSpeed,Mercedes-AMG GT3,1:56.750,113,-36:30.100
41,7,Silver Cup,"Oscar Tunjo, Paul Petit, Marvin Dienst",Toksport,Mercedes-AMG GT3,1:55.245,93,-1:15:18.747
42,77,Pro-AM Cup,"Henrique Chaves, Miguel Ramos, Leo Machitski",Barwell Motorsport,Lamborghini Huracan GT3 Evo,1:55.682,46,-1:59:04.816
43,53,Pro-AM Cup,"Rino Mastronardi, Duncan Cameron, Matt Griffin",AF Corse,Ferrari 488 GT3,1:57.508,40,-3:01:12.797
44,107,Silver Cup,"Gilles Vannelet, Stuart White, Nelson Panciatici",CMR,Bentley Continental GT3,1:56.906,33,-3:22:38.245
45,52,Pro-AM Cup,"Lorenzo Bontempelli, Louis Machiels, Andrea Bertolini",AF Corse,Ferrari 488 GT3,1:57.112,30,-3:30:44.827
46,31,Silver Cup,"Ryuichiro Tomita, Frank Bird, Valdemar Eriksen",Team WRT,Audi R8 LMS GT3,1:56.992,15,-2:38:06.007
NC,33,Silver Cup,"David Perel, Benjamin Hites, Nico Varrone",Rinaldi Racing,Ferrari 488 GT3,,,
