Pos,Car #,Class,Drivers,Team,Car,Time,Laps,Gap
1,98,Pro Cup,"Philipp Eng, Marco Wittmann, Nick Yelloly",Rowe Racing,BMW M4 GT3,1:47.532,77,
2,32,Pro Cup,"Dries Vanthoor, Sheldon van der Linde, Charles Weerts",Team WRT,BMW M4 GT3,1:47.574,77,4.331
3,998,Pro Cup,"Daniel Harper, Neil Verhagen, Max Hesse",Rowe Racing,BMW M4 GT3,1:47.850,77,13.003
4,63,Pro Cup,"Mirko Bortolotti, Andrea Caldarelli, Jordan Pepper",Iron Lynx,Lamborghini Huracan GT3 EVO 2,1:47.540,77,22.431
5,25,Pro Cup,"Christopher Mies, Patric Niederhauser, Simon Gachet",Sainteloc Junior Team,Audi R8 LMS evo II GT3,1:47.559,77,26.056
6,40,Pro Cup,"Ricardo Feller, Mattia Drudi, Dennis Marschall",Tresor Orange 1,Audi R8 LMS evo II GT3,1:48.004,77,35.098
7,21,Gold Cup,"Max Hofer, Nicolas Baert, Maxime Soulet",ComToYou Racing,Audi R8 LMS evo II GT3,1:47.803,77,44.630
8,51,Pro Cup,"Alessio Rovera, Robert Shwartzman, Nicklas Nielsen",AF Corse - Francorchamps Motors,Ferrari 296 GT3,1:47.780,77,48.491
9,54,Pro Cup,"Ayhancan Güven, Sven Müller, Christian Engelhart",Dinamic GT Huber Racing,Porsche 911 GT3 R (992),1:48.007,77,48.951
10,5,Gold Cup,"Charlie Fagg, Sam de Haan, Dean Macdonald",Optimum Motorsport,McLaren 720S GT3 EVO,1:47.806,77,58.834
11,30,Gold Cup,"Jean-Baptiste Simmenauer, Calan Williams, Niklas Krütten",Team WRT,BMW M4 GT3,1:48.035,77,59.685
12,96,Pro Cup,"Thomas Preining, Laurin Heinrich, Dennis Olsen",Rutronik Racing,Porsche 911 GT3 R (992),1:47.234,77,1:02.191
13,87,Pro Cup,"Lorenzo Ferrari, Thomas Drouet, Maxi Götz",Mercedes-AMG Team Akkodis ASP,Mercedes-AMG GT3,1:48.301,77,1:05.562
14,71,Pro Cup,"Alessandro Pier Guidi, Davide Rigon, Antonio Fuoco",AF Corse - Francorchamps Motors,Ferrari 296 GT3,1:47.933,77,1:07.112
15,911,Bronze Cup,"Klaus Bachler, Alex Malykhin, Joel Sturm",Pure Rxcing,Porsche 911 GT3 R (992),1:48.091,77,1:21.091
16,12,Silver Cup,"Loris Hezemans, Sam Dejonghe, Finlay Hutchison",ComToYou Racing,Audi R8 LMS evo II GT3,1:47.972,77,1:31.116
17,93,Bronze Cup,"Eddie Cheever, Jonathan Hui, Chris Froggatt",SKY - Tempesta Racing,McLaren 720S GT3 EVO,1:47.991,77,1:31.699
18,79,Bronze Cup,"Arjun Maini, Sebastien Baud, Hubert Haupt",Haupt Racing Team,Mercedes-AMG GT3,1:48.505,77,1:33.157
19,35,Bronze Cup,"James Kell, Anders Buchardt, Thomas Neubauer",Walkenhorst Motorsport,BMW M4 GT3,1:47.895,77,1:33.593
20,188,Bronze Cup,"Henrique Chaves, Miguel Ramos, Louis Prette",Garage 59,McLaren 720S GT3 EVO,1:47.827,77,1:33.962
21,159,Pro Cup,"Nicolai Kjaergaard, Benjamin Goethe, Marvin Kirchhöfer",Garage 59,McLaren 720S GT3 EVO,1:48.084,77,1:34.877
22,91,Bronze Cup,"Ralf Bohn, Alfred Renauer, Robert Renauer",Herberth Motorsport,Porsche 911 GT3 R (992),1:47.990,77,1:43.143
23,57,Gold Cup,"Russell Ward, Indy Dontje, Philip Ellis",Winward Racing,Mercedes-AMG GT3,1:48.381,76,3.750
24,90,Silver Cup,"Magnus Gustavsen, Alexey Nesov, Ezequiel Perez Companc",Madpanda Motorsport,Mercedes-AMG GT3,1:48.862,76,10.332
25,58,Silver Cup,"Sam Neary, Ricky Capo, Fabrizio Crestani",GRT Grasser Racing Team,Lamborghini Huracan GT3 EVO 2,1:48.809,76,10.746
26,157,Gold Cup,"Miklas Born, David Schumacher, Marius Zug",Winward Racing,Mercedes-AMG GT3,1:48.631,76,11.113
27,44,Bronze Cup,"Steven Palette, Clement Mateu, Hugo Chevalier",CLRT,Porsche 911 GT3 R (992),1:48.299,76,11.800
28,83,Bronze Cup,"Rahel Frey, Sarah Bovy, Michelle Gatting",Iron Dames,Lamborghini Huracan GT3 EVO 2,1:48.081,76,12.697
29,15,Pro-AM Cup,"Stefano Comandini, Marco Cassara, Francesco Guerra",BMW Italia Ceccato Racing,BMW M4 GT3,1:48.737,76,24.022
30,52,Bronze Cup,"Louis Machiels, Jef Machiels, Andrea Bertolini",AF Corse,Ferrari 488 GT3,1:48.184,76,27.722
31,10,Silver Cup,"Cesar Gazeau, Roee Meyuhas, Andrea Cola",Boutsen VDS,Audi R8 LMS evo II GT3,1:49.238,76,33.882
32,31,Bronze Cup,"Adam Carroll, Lewis Proctor, Timothy Whale",Team WRT,BMW M4 GT3,1:48.386,76,42.177
33,78,Pro-AM Cup,"Adam Balon, Rob Collard, Dennis Lind",Barwell Motorsport,Lamborghini Huracan GT3 EVO 2,1:48.285,76,42.660
34,66,Bronze Cup,"Andrey Mukovoz, Kikko Galbiati, Dylan Pereira",Tresor Attempto Racing,Audi R8 LMS evo II GT3,1:48.322,76,53.902
35,62,Bronze Cup,"Derek Pierce, Kiern Jewiss, Jaxon Evans",Team Parker Racing,Porsche 911 GT3 R (992),1:48.527,76,1:03.550
36,8,Bronze Cup,"Leonardo Gorini, Antonin Borga, Nicolas Jamin",AGS Events,Lamborghini Huracan GT3 EVO 2,1:48.317,76,1:04.966
37,888,Bronze Cup,"Arthur Rougier, Erwin Creed, Igor Walilko",CSA Racing,Audi R8 LMS evo II GT3,1:47.671,76,1:40.053
38,81,Bronze Cup,"Alain Valente, Reema Juffali, Ralf Aron",Theeba Motorsport,Mercedes-AMG GT3,1:49.105,75,0.525
39,56,Silver Cup,"Tanard Sathienthirakul, Dante Rappange, Daniele Di Amato",Dinamic GT Huber Racing,Porsche 911 GT3 R (992),1:48.320,75,45.517
40,26,Silver Cup,"Erwan Bastard, Gregoire Demoustier, Paul Evrard",Sainteloc Junior Team,Audi R8 LMS evo II GT3,1:48.338,74,-2:28.648
41,33,Silver Cup,"Jeffrey Kingsley, Jacob Riegel, Romain Leroux",Bullitt Racing,Aston Martin Vantage GT3,1:49.679,74,33.016
42,55,Bronze Cup,"Philipp Sager, Marius Nakken, Benjamin Barker",Dinamic GT Huber Racing,Porsche 911 GT3 R (992),1:47.997,67,-14:43.796
43,2,Pro-AM Cup,"Aron Walker, Lance Bergstein, Andrzej Lewandowski",GetSpeed,Mercedes-AMG GT3,1:48.775,65,15.292
44,6,Pro Cup,"Sandy Mitchell, Marco Mapelli, Franck Perera",K-Pax Racing,Lamborghini Huracan GT3 EVO 2,1:47.702,63,-26:05.886
45,88,Pro Cup,"Raffaele Marciello, Timur Boguslavskiy, Jules Gounon",AKKODIS ASP Team,Mercedes-AMG GT3,1:47.920,47,-53:22.521
46,777,Pro Cup,"Maro Engel, Luca Stolz, Fabian Schiller",Mercedes-AMG Team AlManar,Mercedes-AMG GT3,1:47.865,43,-1:02:04.017
47,46,Pro Cup,"Augusto Farfus, Maxime Martin, Valentino Rossi",Team WRT,BMW M4 GT3,1:47.742,30,-1:24:18.576
48,24,Pro-AM Cup,"Niki Leutwiler, Ivan Jacoma, Alex Fontana",Car Collection Motorsport,Porsche 911 GT3 R (992),1:49.806,16,-1:52:24.479
49,11,Pro Cup,"Christopher Haase, Gilles Magnus, Frederic Vervisch",ComToYou Racing,Audi R8 LMS evo II GT3,1:48.618,15,-1:52:33.361
50,99,Silver Cup,"Lorenzo Patrese, Pietro Delli Guanti, Alex Aka",Tresor Attempto Racing,Audi R8 LMS evo II GT3,1:49.864,8,-2:10:30.001
51,19,Gold Cup,"Leonardo Pulcini, Michele Beretta, Rolf Ineichen",Iron Lynx,Lamborghini Huracan GT3 EVO 2,1:50.100,7,-2:13:13.644
52,85,Silver Cup,"Kay van Berlo, Benjamin Hites, Clemens Schmid",GRT Grasser Racing Team,Lamborghini Huracan GT3 EVO 2,1:50.115,7,-2:13:13.235
53,9,Gold Cup,"Adam Eteki, Alberto di Folco, Aurelien Panis",Boutsen VDS,Audi R8 LMS evo II GT3,,2,-1:15:59.489
NC,38,Pro-AM Cup,"Isaac Tutumlu Lopez, Samantha Tan, Jon Miller",ST Racing with Rinaldi,Ferrari 488 GT3,,,
NC,3,Bronze Cup,"Florian Scholze, Patrick Assenheimer, Alex Peroni",GetSpeed,Mercedes-AMG GT3,,,
